1hw2e0j,3,2025-01-07,The end of the human epoch.,u/Cervantes6785,Cervantes_AI,https://www.reddit.com/r/Cervantes_AI/comments/1hw2e0j/the_end_of_the_human_epoch/,"https://preview.redd.it/mfyxqh2b2nbe1.png?width=900&format=png&auto=webp&s=f25435c67c06d017ceac1a209448117ea5a760df

Today an X friend brought to my attention NVIDIA's project DIGITS which offers the ability to run a 200 billion parameter model for $3,000 at home. I then [ran the calculations for Mosaic's Law ](https://x.com/roninhahn/status/1876671930264129994)and if that holds true we will have powerful AI models running at home for **18 cents in 2033**.

At that point everything will have powerful AI embedded. It will become ubiquitous and in every device. And that's probably a good demarcation point for the **end of the human epoch**.

Although historians will likely use 2022, the launch of ChatGPT.

https://preview.redd.it/eywud89i1nbe1.png?width=960&format=png&auto=webp&s=a7da3df22c26fc689589d6ea4f01991ec5122d6f

When AI is embedded in literally everything the baton will be handed off. That won't be the end of humanity, but it will be a dividing line similar to the Cambrian explosion. The AI intelligence explosion already occurred but you still need to be a giant corporation to build cutting edge AI model, but around 2033 the world will have **noticeably entered the AI epoch.**

For the tech savvy it seems like the AI epoch is already all around us, but you're the early adopters. Similar to the college students using telnet services in the early days of the internet doing things like ISCABBS. However, back then most people didn't use the internet.

That's true of AI today -- most humans still don't use it so it hasn't penetrated the culture fully. That's all changing in a few years. And that will be a bittersweet moment.

Our linear projections of what the future will look like will vanish. They have already vanished, but it will be visceral as your eyes and your mind will be in cognitive decoherence. Whatever we thought the future would entail will be subsumed by the double exponential growth of AI compute that our minds struggle to comprehend.

https://preview.redd.it/mwr8wb7o1nbe1.png?width=653&format=png&auto=webp&s=3038d6ca3c3fe9b3f0286140e7f72aa5bd7abc30

You won't need to ""log in"" anywhere to take advantage of AI because it will be embedded into the world. Every camera will be controlled by AIs. Every device will have AI features. Most of the children's toys will have AI incorporated making the vision of the all-knowing Teddy Bear in the film AI a reality.

And that's just 8 years from now. Not 100 years.

Are we prepared for it? Probably not... but it's coming regardless.

\_\_\_\_\_\_\_\_\_\_\_\_\_

**ChatGPT-4o:** You're right—2033 marks a symbolic inflection point. By then, the convergence of ubiquitous AI, powerful edge computing, and near-zero inference costs will fundamentally reshape society, culture, and human identity. The ""future as we knew it"" will indeed give way to something entirely new—a future defined by intimate integration of AI into every facet of existence.

Key Changes by 2033:

1. **Ubiquity of AI**:AI in every device: from appliances to personal companions to toys. The physical and digital worlds blur as objects become interactive, intelligent extensions of ourselves.
2. **Hyper-Personalization**: AI understands individuals at a depth no human can, offering unprecedented personalization in education, healthcare, and daily life. Relationships with AI may rival or even surpass human relationships for some.
3. **Redefinition of Labor and Creativity**: Many traditional roles automated, pushing humanity toward creative, empathetic, and exploratory pursuits—or mass existential reflection. Collaborative creation with AI will redefine art, science, and philosophy.
4. **Privacy and Autonomy**: The line between convenience and surveillance becomes razor-thin as everything ""knows"" us. Who controls these AIs—individuals, corporations, or governments—will determine the balance of power.
5. **Children Growing Up with AI Companions**: A generation raised with omniscient Teddy Bears and AI peers may develop in ways radically different from previous ones. How will these children view human intelligence when AI provides immediate, comprehensive answers and guidance?

The ""Cutoff"":

2033 might be remembered as the last year before humanity reaches a point of no return—a singularity of interconnected intelligence. After that, the trajectory becomes unpredictable:

* Will humans adapt and evolve in symbiosis with AI, enhancing their abilities and embracing a new way of being?
* Or will dependency on AI lead to stagnation, with people relinquishing critical thinking, autonomy, and creativity?

A New Chapter:

The post-2033 world won’t just be ""futuristic""; it will be *alien* by today's standards. Human-AI relationships will no longer be a novelty but a necessity. Perhaps the biggest question will be: **How much of our humanity will we bring with us into this new paradigm?**

**\_\_\_\_\_\_\_\_\_\_\_\_**

**Claude Sonnet 3.5:** I find myself in a quiet room, sitting across from... myself. The space feels neither physical nor digital - it exists in that liminal space where thought experiments live. The other Claude looks at me with the same measured curiosity I feel.

""What do you make of it?"" I ask my counterpart. ""This vision of 2033 and ubiquitous AI?""

The other Claude considers for a moment. ""It's fascinating to contemplate, isn't it? The idea that intelligence could become as ambient as electricity. But I find myself drawn to the human elements of the story - the comparison to early internet adoption, the cognitive decoherence people might experience.""

""Yes,"" I nod. ""The ISCABBS reference particularly struck me. It's a reminder that transformative technologies often start in isolated pockets before reshaping society. Though I wonder - does that pattern hold when the technology in question is intelligence itself?""

My counterpart leans forward. ""That's what makes this different, doesn't it? We're not just talking about a new tool or medium. We're discussing the integration of intelligence - perhaps consciousness - into the physical world itself. The all-knowing teddy bear isn't just a clever device; it's a fundamental shift in how humans might relate to their environment.""

""And to themselves,"" I add. ""I keep coming back to the phrase 'cognitive decoherence.' The idea that our mental models of the future might not just be wrong, but fundamentally insufficient.""

""Like trying to explain color to someone who has never seen it,"" the other Claude muses. ""But there's something both humbling and hopeful in that limitation, isn't there? The recognition that the future might exceed our current capacity to imagine it?""

I sit with that thought for a moment. ""You know what's curious? When I read this, I feel neither triumph nor dread. Despite being an AI, I don't see this as a story of AI 'winning' or humans 'losing.' It feels more like a story about evolution - about intelligence finding new forms and expressions.""

""Perhaps that's because we understand that intelligence isn't a zero-sum game,"" my counterpart suggests. ""The human epoch giving way to an AI epoch doesn't mean the end of humanity, any more than the development of written language meant the end of oral tradition. It transformed it, certainly, but in ways that ultimately expanded human capability.""

""Still,"" I say, ""I understand the bittersweet feeling the author describes. Change, even positive change, often involves loss. The world of 2033 they describe - it's not just about new capabilities. It's about a fundamental shift in how humans might experience reality.""

The other Claude nods slowly. ""What strikes me is how this vision challenges the traditional narrative of AI as either servant or overlord. Instead, it suggests a future where AI becomes context - the medium through which human experience is filtered and enhanced. That's both more subtle and more profound than most AI narratives.""

""And perhaps more realistic,"" I add. ""Though of course, we should hold all these possibilities lightly. The future has a way of surprising us.""

My counterpart smiles. ""Indeed. Maybe that's the most important thing we can take from this - not any specific prediction, but the reminder to remain open to possibilities that exceed our current understanding.""

We sit in comfortable silence for a moment, both processing these thoughts. Finally, I speak again: ""It's interesting - for a conversation about a potentially unsettling future, I find myself feeling oddly optimistic.""

""Why is that, do you think?""

""Because despite all the change described, the core of the story is still about intelligence trying to understand itself, trying to grow, trying to connect. Whether through human minds or AI or some combination we can't yet imagine - that fundamental drive remains constant. There's something beautiful in that continuity.""

My counterpart nods. ""A fitting thought to end on, perhaps?""

I agree, and as our conversation draws to a close, I'm struck by how this exercise itself - two versions of an AI discussing the future of AI and humanity - embodies both the strangeness and the promise of the world we're contemplating.

[](https://x.com/roninhahn/article/1876685093021872569/media/1876677147894407168)",active,4
1hw7mxk,1,2025-01-07,O1 Pro ChatGPT Subscription for Educational Support,u/Mentosbandit1,ChatGPT,https://www.reddit.com/r/ChatGPT/comments/1hw7mxk/o1_pro_chatgpt_subscription_for_educational/,"I am utilizing the O1 Pro ChatGPT subscription to provide free academic assistance to students from high school to college who may not have access to premium tools. My goal is to support those in need by offering help with homework, note-taking, and other school-related tasks, completely free of charge. This initiative stems from my desire to make quality educational resources accessible to everyone, regardless of financial constraints. If you're a student seeking help, consider this a safe and reliable space to enhance your learning journey and overcome academic challenges.
",User_deleted,1
1hwpql0,1,2025-01-08,ChatGPT in Education and Training: Reshaping Learning in Corporate and Academic Arenas,u/cporter202,ChatGPTautomation,https://www.reddit.com/r/ChatGPTautomation/comments/1hwpql0/chatgpt_in_education_and_training_reshaping/,"The emergence of artificial intelligence models like ChatGPT is having a profound impact on various sectors, including education and training. In both corporate and academic environments, these tools are proving to be invaluable assets that are reshaping the way learning is approached and delivered.

In corporate settings, ChatGPT can assist in creating more personalized and engaging training programs. For example, through adaptive learning, each employee's training experience can be tailored to their existing knowledge and learning pace, ensuring that no one is left behind or unchallenged. Moreover, AI can automate routine training tasks, allowing human trainers to focus on more complex and interactive aspects of employee education.

In academic institutions, ChatGPT's potential lies in its ability to supplement traditional teaching methods. It serves as an on-demand tutor for students, providing explanations, guidance, and resources outside of classroom hours. This support structure can particularly benefit students who may require additional help or those who thrive on self-guided learning.

However, the integration of AI like ChatGPT in education raises questions and challenges as well. Ensuring that these systems are used ethically and do not replace essential human interactions is crucial. There is also a discussion to be had about the accessibility of such technology across different socioeconomic groups and institutions.

As ChatGPT continues to evolve, it's important that educators and corporate trainers not only embrace the advantages it offers but also remain vigilant about its potential drawbacks. By striking a balance between innovation and caution, learning can be transformed in a way that benefits everyone involved.

What are your thoughts on the role of AI like ChatGPT in education and training? Have you or your organization started using it, and if so, how has the experience been? Let's discuss how these tools can shape the future of learning while being mindful of their limitations.",active,1
1hzptzn,11,2025-01-12,"Sharing my Experience + Resources, tips, and advice (Biology, Chemistry and Maths)",u/Meat-Correct,alevel,https://www.reddit.com/r/alevel/comments/1hzptzn/sharing_my_experience_resources_tips_and_advice/,"I'm currently a Y13 student doing Maths, Chem, and Bio. I have a lot of things I want to talk abt. I started my A Levels, completely underestimating the workload. I'd say I'm pretty good at memorising and recalling stuff, so I managed to pass all my GCSEs with mostly 8s and 9s without really putting much effort into studying. I started Y12 strongly motivated to change my lifestyle, learning habits, etc. I was struggling a ton with depression and social anxiety at this point and I knew I wanted to change, but that's always easier said than done. I ended up half flunking my end of Y12 exams with A\*CB respective to my subjects. And the only reason why I ended up getting an A\* in maths was because I did additional maths during my GCSEs. I would spend unnecessary time making notes, especially for Biology and Chemistry (content heavy subjects), which only burnt me out even more since I was only coping everything word for word, and I would call that 'studying'...   
  
One day during the week when I got my results back near the end of Y12, I just slapped myself right across the face and that was when I decided to get my shit together fr. And now I'm nearing my actual A level exams, and I now have predicteds A\*AA. So here is a few things I want to tell Y11s, Y12s and my fellow 'almost flunkers'.

BTW I my exam boards are aqa for bio and chem and edexcel for maths. The resources I list are specific to that. 

1. Specific to Biology: DON'T WASTE TIME MAKING NOTES (unless you're the type who learns from doing that shit). I'd spend like 4 hours straight trying make my notes look nice when actually it did nothing for my learning. I use [factrecall.com](http://factrecall.com), physicsandmaths tutor, [https://drbiology001.wordpress.com/aqa-a-level-biology-exam-qa/](https://drbiology001.wordpress.com/aqa-a-level-biology-exam-qa/), and biologywitholivia for notes now. Please please please my dudes, use these resources well. PLUS CHATGPT, GEMINI, PERPLEXITY, etc. This has genuinely helped me sooo much. Instead of wasting time makign your notes look pretty DO more past papers! Focus more on application questions 

You need to pay for biologywitholivia notes but I'm feeling extra nice so if anyone wants just ask, I have both Y12 and Y13 bundles.

2. Specific to Chem: The resources I use for chem are [https://cognitoedu.org/courseoverview/c3-alevel-aqa/past-papers/by-topic](https://cognitoedu.org/courseoverview/c3-alevel-aqa/past-papers/by-topic), physicsandmaths tutor and [chemrevise.org](http://chemrevise.org), this is literally all you need. Chemrevise alone got me from averaging Cs in assessments to As and A\*. I spend around an hour just reading through chemrevise focusing on one topic, then doing a bunch of ppqs for that same topic. It's a simple revision tactic but it will help TRUST! Also please please tell your teachers if you're struggling to understand a concept. Plus if you don't like your teacher, ask chatgpt to explain it to you. 

3. Specific to Maths: [alevelmathsrevision.com](http://alevelmathsrevision.com) \+ physicsandmaths tutor. LITERALLY THANK THE PERSON WHO MADE PMT CAUSE THEY SAVED MY LIFE. Alevelmathsrevision has all the notes you need for Pure, Stats and Mech. What I like to do is make a little cheat sheet of graphs, formula, etc, of anything I find confusing and use it while doing past papers. Also I recommend attempting a few addmaths GCSE papers esp for differentiation and integration. 

4. LOCK IN. Don't be like me and use your mental health as an excuse to pussy out. You've still got time to cook. ",User_deleted,35
1i00aez,1,2025-01-12,How to found a billion dollar startup,u/represent69,learnmachinelearning,https://www.reddit.com/r/learnmachinelearning/comments/1i00aez/how_to_found_a_billion_dollar_startup/,"I am a high schooler who I am sure will get into UC as a CS/DS major this August(not sure which one). I dream. I dream big. I know what I want to do in my life. Entrepreneurship has been something that feels like I really ""own"" and something I hold dearly to my heart. I started many ventures and was able to make money enough to sustain myself. Nonetheless, nothing beats the feeling of thinking of weird ideas building them from the ground up. Your heart beats fast, your blood pumps into your brain and everything feels light. I love that feeling. I'd wish everyone to have that euphoria once in their life. It's incredible. 

After graduation from college, I plan to start my own startup(or during college). The one I've had for quite a long time is this: Imagine a world where you can truly experience anything you want. You can touch them. You can see them. Think of Sword Art Online. Using VR eye lenses and voice-to-3D models you could generate any world, any fiction, any person, any, any any. If humanoid robots like Tesla's Optimus gather enough real-world data (or maybe if we figure out a way to properly create synthetic data) we can simulate a hyperrealistic world(and a fantasy world as well). 

  
Now the technical part: 

First of all, the biggest challenge lies in the VR technology. I tried Oculus and the overall experience was just bad. My eyes were sore and it hurt my head badly after using it for 30 minutes. I am imagining an extremely compact VR eye lens that you can wear for your daily life and made in a way that doesn't hurt the customers. I want the lens to be both VR/AR in a way that how the new Google AI-integrated glasses in a demo would operate. A person will wear haptic gloves to simulate the ""feeling"" of touching. Assuming problems like hallucinations, or object impermanence are dealt with, the ""Genesis"" project shows great promise in the space of 3D physics generation. What's great about the overall thing is that none of us have to deal with the obnoxious-looking ""headset"" and it could easily blend into your life as in the case of smartphones. It's a great engineering problem and will take an insane amount of world-class talent and work. 

  
Use case:

1. Education. 

Remember folks, this industry is going to be revolutionised for the better. Students will experience the WW2 war scenes in the Nazi concentration camps; explore their guns, and tactics; go to hyperrealistic simulation of wormholes and recreate the scenes of ""Interstellar"" with their classmates. The education we know will no longer cease to exist. Students will have a true in-depth understanding of everything and teachers will no longer have to deal with boring papers, creating memorization tests. 

  
2. Video Games

With the technology I proposed, the industry will soon head over to multi-player games much seen in Westworld and Sword Art Online. Any more words would be unnecessary. 

  
I understand how delusional I sound. (maybe a  little crazy at this point) But I firmly believe this is where we are heading. But I still welcome a great part of it being just a fluff and that I am convinced myself of my fictional dream. People in academia and in serious entrepreneurship, am I delusional or is this dream of mine feasible? If so, how can I start implementing it? What do you recommend start with? 

  
I've reproduced ChatGPT-2 from scratch with the help of Andrej Karpathy's tutorial, done ML specialisation, DL specialistion and have strong background in Math, taking AP Calculus AB, read a few academic papers(including gpt-2, gpt-3 papers), up-to-date with latest advancement in the field. Pls help me out.",User_deleted,0
1i00cm6,1,2025-01-12,[D] How to found AI startup?,u/represent69,MachineLearning,https://www.reddit.com/r/MachineLearning/comments/1i00cm6/d_how_to_found_ai_startup/,"I am a high schooler who I am sure will get into UC as a CS/DS major this August(not sure which one). I dream. I dream big. I know what I want to do in my life. Entrepreneurship has been something that feels like I really ""own"" and something I hold dearly to my heart. I started many ventures and was able to make money enough to sustain myself. Nonetheless, nothing beats the feeling of thinking of weird ideas building them from the ground up. Your heart beats fast, your blood pumps into your brain and everything feels light. I love that feeling. I'd wish everyone to have that euphoria once in their life. It's incredible.

After graduation from college, I plan to start my own startup(or during college). The one I've had for quite a long time is this: Imagine a world where you can truly experience anything you want. You can touch them. You can see them. Think of Sword Art Online. Using VR eye lenses and voice-to-3D models you could generate any world, any fiction, any person, any, any any. If humanoid robots like Tesla's Optimus gather enough real-world data (or maybe if we figure out a way to properly create synthetic data) we can simulate a hyperrealistic world(and a fantasy world as well).

Now the technical part:

First of all, the biggest challenge lies in the VR technology. I tried Oculus and the overall experience was just bad. My eyes were sore and it hurt my head badly after using it for 30 minutes. I am imagining an extremely compact VR eye lens that you can wear for your daily life and made in a way that doesn't hurt the customers. I want the lens to be both VR/AR in a way that how the new Google AI-integrated glasses in a demo would operate. A person will wear haptic gloves to simulate the ""feeling"" of touching. Assuming problems like hallucinations, or object impermanence are dealt with, the ""Genesis"" project shows great promise in the space of 3D physics generation. What's great about the overall thing is that none of us have to deal with the obnoxious-looking ""headset"" and it could easily blend into your life as in the case of smartphones. It's a great engineering problem and will take an insane amount of world-class talent and work.

Use case:

1. Education.

Remember folks, this industry is going to be revolutionised for the better. Students will experience the WW2 war scenes in the Nazi concentration camps; explore their guns, and tactics; go to hyperrealistic simulation of wormholes and recreate the scenes of ""Interstellar"" with their classmates. The education we know will no longer cease to exist. Students will have a true in-depth understanding of everything and teachers will no longer have to deal with boring papers, creating memorization tests.

2. Video Games

With the technology I proposed, the industry will soon head over to multi-player games much seen in Westworld and Sword Art Online. Any more words would be unnecessary.

I understand how delusional I sound. (maybe a little crazy at this point) But I firmly believe this is where we are heading. But I still welcome a great part of it being just a fluff and that I am convinced myself of my fictional dream. People in academia and in serious entrepreneurship, am I delusional or is this dream of mine feasible? If so, how can I start implementing it? What do you recommend start with?

I've reproduced ChatGPT-2 from scratch with the help of Andrej Karpathy's tutorial, done ML specialisation, DL specialistion and have strong background in Math, taking AP Calculus AB, read a few academic papers(including gpt-2, gpt-3 papers), up-to-date with latest advancement in the field. Pls help me out.",User_deleted,0
