17od3qe,1106,2023-11-05,Guide to the mythical viral coefficient. Modern examples + how it grew my business to $450k ARR.,u/Toxic-Headshott,Entrepreneur,https://www.reddit.com/r/Entrepreneur/comments/17od3qe/guide_to_the_mythical_viral_coefficient_modern/,"**Note**: Been lurking on this sub and reddit in general for quite some time but I felt like this would be a valuable post for both people in the ideation and product stage. I wish someone told me these things when I started out. With that being said, some of this content might be a refresher for some of you, but hopefully I can shine light on some use cases that are still helpful. Also this is not to say I’m some big shot making $450k ARR, but I think there are lessons here. This post is for anyone who is in B2B or B2C that has an online presence. The focus is on software because that’s what I know, but this could be done with services or other verticals as well.  
  
The viral coefficient is a concept I’ve been interested in ever since I read the infamous Viral Loop book by Adam Penenberg back in 2009. A viral coefficient is just how many new customers an existing customer brings in on average. If you have a sustained viral coefficient of 2, then each customer brings 2 new customers and you spread organically. It’s how Facebook, PayPal, Email services, ChatGPT, etc. all grew. It would be wrong to limit this in scope to just B2C products. It can happen with B2B where you ask clients for referrals and word begins to spread about your product. There’s also more subtle ways of doing it just like how typeform did. If you’re doing anything in the digital space this is crucial to think about.   
To put it more succinctly: make something others love so much they tell their friends. Let’s walk through some examples and then explore specific takeaways.   
  
**Past Examples of Viral loops:**

  
**PayPal:** Paypal had a particularly interesting viral strategy. It started off as just sending money over the Internet to another person with a focus on the Ebay niche. If a new person signed up, they would get $5. Of course this incentive was unsustainable as they would have burned all their VC money, but it helped initiate the process. 

  
**Facebook:** Perhaps the most notorious example of a viral coefficient. Like PayPal, they started in a niche, which we all know was Harvard. It naturally played on people’s curiosity. If someone was posting about you or someone you knew, you wanted to sign up and see what was going on. Eventually they started opening access up to other universities before finally giving access to everyone. At that point, it completely blew up. 

  
**HotMail:** Hotmail utilized a pretty effective viral marketing strategy by including a tagline at the end of every email sent by its users that read ""Get your free email at Hotmail."" This basically turned every email sent into a potential Hotmail sign-up. By leveraging the network effects where users were communicating with non-users, Hotmail rapidly increased its user base. It started to spread like wildfire because each user inadvertently advertised Hotmail every time they sent an email. This signature line was so influential that despite the negligible cost of including it, it propelled Hotmail to amass millions of users within an extremely short period after its launch.  
  
**Uber:** This is the platform that I took the most inspiration from. Their viral growth strategy is probably most applicable to people here because it was multifaceted: word-of-mouth, referral incentives, strategic marketing campaigns, etc.. In its early days, Uber incentivized both its drivers and riders to share their referral codes with others by offering ride credit or a bonus payout. For riders, there was the appeal of a free or discounted ride for signing up through a friend's referral link was a strong incentive to try the service. And for drivers, the promise of extra earnings for referring new drivers played a big role in expanding the workforce quickly. Additionally, Uber capitalized on the exclusivity and luxury of its initial ""black car"" service to create hype in the markets it entered. The strategy was to create a prestigious image and then open the platform to a wider audience with more economical options like UberX, allowing it to scale up rapidly.  


  
**A viral loop in the making - a 2023 example**

  
**Example:** If this hasn’t started already, then most of the emails you receive are about to have another email CCd: m@mindy.com. This is an AI agent that was built by a cofounder of Paypal / first employee of YouTube, the third employee of YouTube, and an MD from Accenture. For the sake of not revealing too much and focusing on the product, just email it and see what it can do if you’re curious and you’ll see why I’m saying this. They’ve set up a system where onboarding another user is as simple as CCing the AI into the email and it will start interacting and performing autonomous tasks for you.   
  
**The takeaway:** If this works out, then it will spread faster than anyone can possibly imagine and may be the defining viral loop of the next year and possibly years to come. The reason? It’s easy to sign up and there’s a direct incentive to CC the AI to someone you’re emailing. It can go and help you solve problems you’re working on. Whether that’s parsing through a 60+ page document, researching an esoteric scientific tolic, or scheduling meetings for teachers and students. This is what’s important to remember: make it as easy as possible for customers to get you customers and when designing your product keep this principle in mind. If connecting someone to the existing product makes it better for you then you’ll have something that can blow up. The tricky part is creating something that has virality already built in, so for those of you not in the ideation phase, I feel you because that’s me.  
  
**My own company - a contrived but functioning viral coefficient**

  
**Example:** Not every product can have a viral coefficient like Mindy, that’s partially because they built it with that in mind. If you’re like me and already have a product, there are still things you can do in order to incentivize folks to use your product.   
For context in my own company (which I will not link to here for the sake of following the subreddit’s rules - if you want proof feel free to DM me), I bootstrapped one of those AI photo generators that was really popular in 2022 / part of 2023. I used stabilitiy’s stable diffusion image model + google’s dream booth to generate photorealistic and artistic images of user’s faces to show their friends. It never blew up in the same way Lensa/Remini did, but what I did was lock utility behind closed doors. More specifically, I locked certain photos users could generate behind closed doors. If they wanted to generate those particular types of photos, they’d have to do a social media post about the product and their results. This meant all their friends saw an image of themselves generated. Since their friends are the ones who know how they look, they were naturally interested to see how they themselves looked. Whenever someone with a big following would post this out, I would see a surge in traffic to the site.  
  
**My Takeaway**: While I didn’t have a viral coefficient of 1.0 and have since had lower growth numbers (partially due to comodization/market saturation), I found a way to get my product to market itself. Other than a few influencer ad campaigns, most of my growth was organic inbound. You can create incentives by giving users access to more features through a referral program. Of course, my example is specific to my company but I think there’s a lot of ways this can be done for many different companies. Including B2B. I ran a SaaS in the past (was acquired) and offered a really large client access to early features to give them a competitive edge in return for 10 warm introductions to other clients. If any of you want help brainstorming on your product, I’m happy to help in the comments. To build a viral product: start in a niche, make something people love so much they tell their friends, make the onboarding process simple (e.g. free to use), and most importantly create a product that incentivizes other folks to use it. If you didn’t build your product with a viral coefficient in mind, then creating a false sense of scarcity by locking certain product features behind a referral program or in the B2B case (asking for referrals to other clients) won’t get you to a VC of 1.0 but it will still help you get organic inbound. I’m hoping to take my learnings here and make my next product have a viral coefficient above 1.0. ",User_deleted,1109
17oh0ah,4,2023-11-05,AI Weekly Rundown (October 28 to November 04),u/RohitAkki,ArtificialInteligence,https://www.reddit.com/r/ArtificialInteligence/comments/17oh0ah/ai_weekly_rundown_october_28_to_november_04/,"Major AI announcements from Hugging Face, OpenAI, Microsoft, Apple, Google, and more.  


* **Hugging Face has released Zephyr-7b-beta, an open-access GPT 3.5 alternative**  
\- The latest version if Zephyr by the H4 team is topping all 7b models on chat evals and even 10x larger models. It can answer like ChatGPT, run on your desktop without the need to quantize, and outperform Llama2 70B.  
\-Based on Mistral 7b, Zephyr-7B is a smaller language model that uses supervised distillation techniques and direct distilled preference optimization to improve intent alignment and achieve top-tier performance in chat benchmarks.
* **A model by Twelve Labs understands video**  
\- It is announcing its latest video-language foundation model Pegasus-1 along with a new suite of Video-to-Text APIs. Contrary to existing solutions that either utilizes speech-to-text conversions or rely solely on visual frame data, Pegasus-1 integrates visual, audio, and speech information to generate more holistic text from videos.
* **ChatGPT Plus members can upload and analyze files in the latest beta**  
\- Once a file is fed to ChatGPT, it takes a few moments to digest and then do things like summarize data, answer questions, or generate data visualizations based on prompts. It can chat with pdfs, data files, and other document types. Check out the other updates in the newsletter.
* **Microsoft Azure AI’s new system advances video understanding with GPT-4V**  
\- A paper by Microsoft Azure AI introduces a system “MM-VID” ,that combines GPT-4V with specialized tools in vision, audio, and speech to enhance video understanding. It addresses challenges in analyzing long-form videos and complex tasks like understanding storylines spanning multiple episodes.   
\- It uses GPT-4V to transcribe multimodal elements into a detailed textual script, enabling advanced capabilities like audio description and character identification. 
* **President Joe Biden signed an executive order for AI safety**  
\- President Joe Biden has signed an executive order directing government agencies to develop safety guidelines for AI. The order aims to create new standards for AI safety and security, protect privacy, advance equity and civil rights, support workers, promote innovation, and ensure responsible government use of the technology.   
\- It calls for the sharing of safety test results by developers of large AI models and urges Congress to pass data privacy regulations.
* **Microsoft’s new AI teaching tool in collab with teachers**  
\- Microsoft Research has collaborated with teachers in India to develop an AI tool called Shiksha copilot, which aims to enhance teachers' abilities and empower students to learn more effectively. The tool uses generative AI to help teachers quickly create personalized learning experiences, design assignments, and create hands-on activities.   
\- It also helps curate resources and provides a digital assistant centered around teachers' specific needs. The tool incorporates multimodal capabilities and supports multiple languages for a more inclusive educational experience.
* **Quora’s Poe have launched monetization for creators**  
\- Poe will now pay bot creators for their efforts, making it one of the first platforms to monetarily reward AI bot builders. Bot creators can generate income by leading users to subscribe to Poe or by setting a per-message fee. The program is currently only available to U.S. users. Quora hopes this program will enable smaller companies and AI research groups to create bots and reach the public. 
* **ElevenLabs rolls out Enterprise AI Speech Solutions**  
\- It offers businesses advanced speech solutions with high-quality audio output and enterprise-grade security. The platform can automate audiobook creation, power interactive voice agents, streamline video production, and enable dynamic in-game voice generation. It offers exclusive access to high-quality audio, fast rendering speeds, priority support, and first looks at new features.   
\- ElevenLabs' technology is already being used by 33% of the S&P 500 companies. The company's enterprise-grade security features, including end-to-end encryption and full privacy mode, ensure content confidentiality.
* **Dell Technologies has partnered with Meta to bring the Llama 2 for its enterprises**  
\- Dell will add support for Llama 2 models to its Dell Validated Design for Generative AI hardware and generative AI solutions for on-premises deployments. Dell will also guide its enterprise customers on deploying Llama 2 and help them build applications using the open-source technology.   
\- Dell is using Llama 2 for its own internal purposes, including supporting Retrieval Augmented Generation (RAG) for its knowledge base.
* **Apple continues to enhance its products with AI**  
1) Apple unveiled M3, M3 Pro, and M3 Max, the most advanced chips for a personal computer. They have an enhanced Neural Engine to accelerate powerful ML models. The Neural Engine is up to 60% faster than in the M1 family of chips, making AI/ML workflows even faster while keeping data on device to preserve privacy.   
2) A new AI health coach is in the works. Apple is discussing using AI and data from user devices to craft individualized workout and eating plans for customers.
* **Stability AI previews enhanced image offerings**  
\- It rolled out new initiatives for generative AI imaging, including Sky Replacer, Stable 3D, and Stable Fine Tuning– available & in private preview. Check out the newsletter for more info!
* **Google’s MetNet-3 - first AI weather model making high-resolution predictions up to 24 hours**  
\- Google has integrated MetNet-3’s capabilities across various Google products and technologies where weather is relevant. Currently available in the contiguous United States and parts of Europe with a focus on 12-hour precipitation forecasts, MetNet-3 is helping bring accurate and reliable weather information to people in multiple countries and languages.
* **SAP’s new AI tool for developers**  
\- SAP introduces SAP Build Code, an application development solution that incorporates gen AI to streamline coding, testing, and managing Java and JavaScript application life cycles.   
\- This new offering includes pre-built integrations, APIs, and connectors, as well as guided templates and best practices to accelerate development. It enables collaboration between developers and business experts, allowing for faster innovation. 
* **Cohere released Embed v3, latest & most advanced text embedding model**  
\- It offers top-notch performance in matching queries to document topics and assessing content quality. Embed v3 can rank high-quality documents, making it useful for noisy datasets. The model also includes a compression-aware training method, reducing costs for running vector databases. Developers can use Embed v3 to improve search applications and retrievals for RAG systems.
* **Luma AI’s Genie generates everything in 3D from only text**  
\-  Genie is powered by a deep neural network that has been trained on a large dataset of 3D shapes, textures, and scenes. It can learn the relationships between words and 3D objects and generate novel shapes that are consistent with the input.

&#x200B;

* And there was more….
   * **Google to invest $2 billion in Anthropic** \- It invested $500 million upfront into Anthropic earlier and had agreed to add $1.5 billion more over time.
   * **WhatsApp is working on new AI support chatbot feature** \- It will streamline in-app issue resolution without emailing. Whatsapp will respond in a chat with AI-generated messages and users will also be able to interact with manual chat support in a few taps. The feature will also resolve common issues and answer about WhatsApp features.
   * **Perplexity announced two new models trained in-house, pplx-7b-chat and pplx-70b-chat** \- Both models are built on top of open-source LLMs and prioritize intelligence, usefulness, and versatility on an array of tasks, without imposing moral judgments or limitations.
   * **Google Bard now responds in real time and you can cut off its response** \- Bard previously only sent a response when it was complete. You can now switch between “Respond in real time” and “Respond when complete”. Like ChaGPT, you can also cut off the bot mid-response.
   * **Citibank to grant majority of its over 40,000 coders access to generative AI** \- As part of a small pilot program, the Wall Street giant has quietly allowed about 250 of its developers to experiment with generative AI.
   * **Practica launched career coaching and mentorship AI chatbot** \- It acts as a personalized workplace mentor and coach, offering guidance on various topics such as management, strategy, sales, and more.
   * **Alibaba upgrades its AI model and released industry-specific models** \- It has launched 8 AI models for various industries, including entertainment, finance, healthcare, and legal sectors. The models provide dedicated tools for image creation, coding, financial data analysis, and legal document search.
   * **NVIDIA’s engineers showcased how AI can help in designing semiconductor chips** \- A new NVIDIA Research paper describes how ChipNeMo, an LLM customized with NVIDIA NeMo, can help design semiconductors. It was trained on Nvidia's internal data and can generate and optimize software, as well as assist human designers.
   * **MIT scientists developed an AI copilot system ‘Air-Guardian’ for flight safety** \- The system works with airplane pilots, based on a deep learning system called Liquid Neural Networks (LNN), can detect when a human pilot overlooks a critical situation and intervene to prevent potential incidents.
   * **Google DeepMind’s AlphaFold going beyond protein prediction** \- AlphaFold 2 has been further improved to accurately predict the structures of proteins, ligands, nucleic acids, and post-translational modifications. This new capability is particularly useful for drug discovery, as it can help scientists identify and design new molecules that could become drugs.
   * **Microsoft and Siemens partnered to drive the adoption of AI across industries** \- They have introduced Siemens Industrial Copilot, an AI-powered assistant that enhances collaboration between humans and machines. They will also develop additional copilots for manufacturing, infrastructure, transportation, and healthcare. 
   * **Shield AI has raised $200M in a Series F funding round** \- The company's Hivemind system and V-BAT Teams product enable autonomous aircraft operation without the need for remote operators or GPS. 
   * **AI can diagnose diabetes from your voice** \- Researchers have trained an AI model to diagnose type 2 diabetes in patients within 10 seconds by analyzing their voice. When paired with basic health data, it could significantly lower the cost of diagnosis. It cal also be used remotely and automatically, transforming how diabetes is screened for in the medical community.
   * **New AWS service lets customers rent Nvidia GPUs for quick AI projects** \- AWS launched Amazon Elastic Compute Cloud (EC2) Capacity Blocks for ML, enabling customers to buy access to these GPUs for a defined amount of time, typically to run some sort of AI-related job such as training a machine learning model or running an experiment with an existing model.
   * **LinkedIn hits 1 billion members, adds more AI features for job seekers** \- Paying users will get new AI features that can tell a user whether they're a good candidate based on their profile and recommend changes to make them more competitive for a job.
   * **Instagram spotted developing a customizable ‘AI friend’** \- It seems Instagram has been developing an “AI friend” feature that users could customize to their liking and then converse with, brainstorm ideas, and much more. Users will be able to select their gender, age, ethnicity, personality, name, etc.
   * **Snowflake makes leading AI models and LLMs accessible to all users with Cortex** \- Snowflake Cortex is a fully managed service that enables organizations to more easily discover, analyze, and build AI apps in the Data Cloud.
   * **AI named word of the year by Collins Dictionary** \- The use of the term has quadrupled this year. The increase in conversations about whether it will be a force for revolutionary good or apocalyptic destruction has led AI to this title.
   * **Midjourney introduced a new feature ‘Style-tuner’** \- For easier and more unified image generation, users can select from a variety of styles and obtain a code to apply to all their works, keeping them in the same aesthetic family. To use the style tuner, users simply type ""/tune"" followed by their prompt in the Midjourney Discord server.
   * **Runway released an update to its Gen-2 model with incredible AI video capabilities** \- The update includes major improvements to the fidelity and consistency of video results. Gen-2 allows users to generate new 4-sec videos from text prompts or add motion to uploaded images. The update also introduces ""Director Mode,"" which allows users to control the camera movement in their AI-generated videos.
   * **Microsoft’s new survey on business value and opportunity of AI** \- The study surveyed over 2k business leaders and decision makers and found that: 71% of companies are already using AI, AI deployments typically take 12 months or less, organizations are seeing an ROI in AI within 14 months, and more.
   * **Brave privacy-focused browser, has introduced new AI Leo** that claims to offer unparalleled privacy compared to other chatbot services like Bing and ChatGPT. Leo can translate, answer questions, summarize webpages, and generate content.

More detailed breakdown of the major news and innovations in the [weekly edition](https://theaiedge.substack.com/p/ai-weekly-rundown-october-28-to-november-3).",active,3
17pqdip,2,2023-11-07,ChatGPT for Students - 16 Prompts to Help Them Excel in School,u/telultra,ESL_Teachers,https://www.reddit.com/r/ESL_Teachers/comments/17pqdip/chatgpt_for_students_16_prompts_to_help_them/,"Fellow teachers have been asking for this video for a very long time. So, there you have it! 16 Genius ChatGPT Prompts for Students to Excel in School!  


🎒👎Most students are not taught how to use ChatGPT, so they use it in a non-legitimate, helpful way. Let's change that!   


🎯👍In this video, you'll discover 16 carefully selected advanced prompts for students, which will transform ChatGPT or any other Chatbot into a valuable educational tool.  


⬇️  
[https://youtu.be/Jtb6Ztxfy9I](https://youtu.be/Jtb6Ztxfy9I) 

https://preview.redd.it/zn9e36v48wyb1.jpg?width=1280&format=pjpg&auto=webp&s=015a1d1e30b560f2e320d85f9aa591acf4ed9bfc",active,2
17pqedf,1,2023-11-07,ChatGPT for Students - 16 Prompts to Help Them Excel in School,u/telultra,englishteachers,https://www.reddit.com/r/englishteachers/comments/17pqedf/chatgpt_for_students_16_prompts_to_help_them/,"Fellow teachers have been asking for this video for a very long time. So, there you have it! 16 Genius ChatGPT Prompts for Students to Excel in School!  
🎒👎Most students are not taught how to use ChatGPT, so they use it in a non-legitimate, helpful way. Let's change that!   
🎯👍In this video, you'll discover 16 carefully selected advanced prompts for students, which will transform ChatGPT or any other Chatbot into a valuable educational tool.  
⬇️  
https://youtu.be/Jtb6Ztxfy9I   
",active,1
17r8jj7,1,2023-11-09,Would ChatGPT plus be worth it for an IB student?,u/RedditMunchkin,ChatGPT,https://www.reddit.com/r/ChatGPT/comments/17r8jj7/would_chatgpt_plus_be_worth_it_for_an_ib_student/,"Like in the title, I'm a student who just started the IB program , and I've really gotten into prompt engineering and learning how to use ChatGPT to it's fullest extent. And so far, it has helped me with a lot of assignments, understanding, and more, but I can't really rely on it for accuracy. I want to use ChatGPT to also help explain concepts (including quantitative concepts), which GPT3.5 is apparently not so good at, and was considering getting GPT plus.  I also do use it for a million other things in the educational field, which I think GPT plus would help in.",User_deleted,1
