196epti,11,2024-01-14,Passed the 601 with 764 score in 1st attempt,u/Designer_Hornet_7330,CompTIA,https://www.reddit.com/r/CompTIA/comments/196epti/passed_the_601_with_764_score_in_1st_attempt/,"&#x200B;

Hey everyone, I'm thrilled to share my experience acing the CompTIA Security+ SY0-601 exam on the first attempt with a score of 764! It was a wild ride, but with the right strategies and resources, I conquered the beast. So, buckle up and let's dive into my journey!

&#x200B;

Background:

&#x200B;

I'm a second-year CS student with basic programming skills (C, Java, Python, SQL) and knowledge of operating systems, Linux (basic), and DBMS. No prior IT experience or A+ or Network+ certifications

&#x200B;

Preparation Timeline:

I dedicated roughly 5 months to preparation, with intermittent study sessions due to college exams. However, the last month involved intense study sessions, averaging 6 hours per day.

&#x200B;

Resources:

Professor Messer's YouTube playlist(main Resource): My go-to for comprehensive explanations and clear concepts.-[https://youtube.com/playlist?list=PLG49S3nxzAnkL2ulFS3132mOVKuzzBxA8&si=CnifJERIGaA-OUVV](https://youtube.com/playlist?list=PLG49S3nxzAnkL2ulFS3132mOVKuzzBxA8&si=CnifJERIGaA-OUVV)

Exam Cram's YouTube playlist: Great for supplementing Messer's videos or You can use both.-[https://youtube.com/playlist?list=PL7XJSuT7Dq\_VD3eHXQf3Ld2ceBSFCayns&si=2NBSOd7GhilLIsv6](https://youtube.com/playlist?list=PL7XJSuT7Dq_VD3eHXQf3Ld2ceBSFCayns&si=2NBSOd7GhilLIsv6)

Darly Gibson's ""CompTIA Security+ Get Certified Get Ahead"": A fantastic book for solidifying knowledge and practicing MCQs.(Definetly recommend)

Powercert Animated videos: My lifesaver for understanding networking concepts!-[https://youtu.be/kDEX1HXybrU?si=kI6UWgNY0frJk8Nx](https://youtu.be/kDEX1HXybrU?si=kI6UWgNY0frJk8Nx)

Remembering ports and protocols video: A quick and catchy way to memorize those crucial details.-[https://youtu.be/8lQWmHDeD5c?si=ekIvSbdC165YEna1](https://youtu.be/8lQWmHDeD5c?si=ekIvSbdC165YEna1)

Cybercrafts YouTube channel: Mastered PBQs with his detailed tutorials.

Jason Dion's practice tests on Udemy: Realistic tests that helped me gauge my readiness (60-68% scores),Although many recommend me the professor messer practice tests but i couldn't do it because i was short of time but if you have time you can also try professor messer.

&#x200B;

[101labs.net](https://101labs.net): Hands-on labs for practical experience and long-term retention-[https://www.101labs.net/comptia-security/](https://www.101labs.net/comptia-security/)

&#x200B;

Study Strategy:

&#x200B;

Early morning focus on book chapters, reading complete chapter at a time.

Daytime emphasis on Professor Messer's video lectures on different domains.

Afternoon sessions also dedicated to Professor Messer's videos with note-taking.

Nighttime reserved for PBQs and practicals from [101labs.com](https://101labs.com).

watched professor messer study groups while travelling.(this really helped me and i recommend you if you travel daily)

Sequential learning: Studied domains in order, then revisited them with the book and videos for deeper understanding.

Revision with AI: In the last 10 days, ChatGPT and Bard helped me refine my knowledge by explaining topics about which i dind't remeber.

Motivation: Followed the CompTIA subreddit for encouragement and learning from others' experiences.

&#x200B;

Exam Day:

&#x200B;

I encountered around 74 MCQs and 4 PBQs (firewall config, attacks, networking). I initially skipped the PBQs, focusing on the MCQs. In the final 40 minutes, I tackled the PBQs and reviewed some unsure MCQs. I felt shaky, but my preparation paid off!

&#x200B;

Key Takeaways:

&#x200B;

Plan and prioritize: Create a study schedule and stick to it.

Find the right resources: Choose materials that resonate with your learning style.

Practice makes perfect: Take practice tests and hands-on labs to build confidence.

Don't skip the PBQs: Allocate time for them, even if you tackle them later.

Remember: Everyone's journey is unique. Adapt my strategies to your needs and rock that exam! Feel free to ask me anything about the experience, and let's conquer the cybersecurity world together!

&#x200B;

Thank you for reading about my journey, and best of luck to those preparing for the CompTIA Security+ exam!",active,12,positive,0
196o8cm,48,2024-01-14,What do I teach my students? When will all this be more public?,u/genoeseextraction,singularity,https://www.reddit.com/r/singularity/comments/196o8cm/what_do_i_teach_my_students_when_will_all_this_be/,"I'm an English teacher who's been obsessed with AI ever since ChatGPT came out. Before that, I thought the skills taught in an English class were some of the most important you could have. Now, I wonder what the point of it all is. I've gotten over it by reminding myself that students still need these skills for college and that they serve as conduits and catalyzers of thought but I wonder how fast college itself will be obsolete, for example. It'd been pretty hard staying motivated in this limbo state waiting to see what's going to happen but now I think I'm over it and just enjoy the process for other reasons. I guess my questions would be:

\-Is there anything notable now worth teaching or mentioning to high school students in 2024?

\-How do I react when they tell me about the careers they want to go into?

\-How long until we get some clear answers and see some changes that bring the considerations of this sub to the public?

I really think all this is the most important thing that's ever happened and wish it was given its due attention. I wonder when that will be.",active,50,neutral,0
197r0hr,101,2024-01-15,English teacher is forcing students to handwrite the HL Essay,u/knot_rotate,IBO,https://www.reddit.com/r/IBO/comments/197r0hr/english_teacher_is_forcing_students_to_handwrite/,"Hi, I am a grade 11 student from a Canadian public school studying in the first year of the DP programme. Our class has begun writing their English essay but with a small problem. The essay can only be handwritten with simply a max 2-page essay outline which is not sufficient for several students. My teacher argues that due to rising concerns about AI and students writing their essays via ChatGPT, it is fair to avoid taking any risks before our work gets sent to the IB. However, recently I discovered that the IB is not completely opposed to AI so long as you cite it. In my school, there's also another teacher who runs an HL English class as well, however, that class is not forced to handwrite their essays simply due to the discretion of the teacher. I think this violates IB's inclusion and equity policies. A student has tried contacting the coordinator in our school to resolve this issue however the response was to simply go with it and not be petty about it because the English teachers know what they are doing and other teachers are not allowed to intervene in their line of teaching.   


What is the next best thing for me to do? (The essay is due in 1 week for us)",active,101,neutral,0
1987uy4,1,2024-01-16,Other students rant,u/NinZargo,UniUK,https://www.reddit.com/r/UniUK/comments/1987uy4/other_students_rant/,"I hope this is just my experience but fear that it is not.

I am studying Computer Systems Engineering at a mid range uni in rankings and am in 2nd year. 

So far while my social experience has been amazing, the academic side has left a lot to be desired.

During my 1st year I wasn't too bothered about it being a pretty easy course I understood they had to give everyone a decent foundation and make sure everyone was in the same place, while I did complain to my course lead about them pitching it wayyy too low I later realised for the majority it was not pitched too low.

I am by no means a super student I got average results in GCSEs and because I just didn't revise achieved BBC in A levels. But I am amazed at the severe lack of intelligence in my course people are proving the statement ""there are no stupid questions"" wrong on the daily, with their answers being even worse when they actually do answer rather than sit around like zombies waiting. Then when after they put no effort in something they can't do comes up instead of trying to work it out they talk to the course reps about how it's too challenging. E.g. we had to workout how to do some basic file manipulation in java and people complained that they weren't told how to. This is only the tip of the iceberg, the uni seem to be badgering to there beck and call as I really can't see how this course could have always been like this.

The Uni is not any better than the students they find, they teach from nothing known about programming at a degree level which seems illogical everyone had the opportunity to study computer science at a level, if your college didn't offer it then change colleges and even then you could just teach yourself online.

Anyway that is just the start but I have an opportunity to talk to the iet about the course I am incredibly tempted to accept this opportunity and make all these complaints very known as whenever it has been mentioned to the correct people they either ignore or claim to look into it so I'm hoping this will finally give the uni the kick they need to actually create qualified engineers rather than chatgpt zombies with pieces of paper.

If anyone has any advice on ways to try and improve my academic experience that would also be greatly appreciated",User_deleted,1,neutral,0
198a82y,82,2024-01-16,Uni is easier being a bad student,u/Tall-Challenge8526,UniUK,https://www.reddit.com/r/UniUK/comments/198a82y/uni_is_easier_being_a_bad_student/,"I'm a last year student and I don't know how I am meant to be a good student. I see so many lecturers post here, frustrated with what students are like nowadays and I can understand them. So many students seem to need information spoon fed to them, barely attend lectures or seminars, or rely on AI. 

I tried to do my best, but it feels impossible. I have to work 20-30 hours a week to afford being at uni, my course has 20-30 hours of lectures a week scheduled, and I have to complete projects and somehow revise for exams at the same time. It's so much. Last year I just completely gave up attending lectures and my grades went up about 10% for all my modules. I have stopped learning the content and just trained myself to learn how to prepare for the exams. There's basic knowledge that I should know for my course and I've retained nearly none of it.

The less I attend to lectures and actually learn content, the better my grades seem to do.

One thing I've never done is cheat. The closest I may have gotten, is ask chatgpt how to structure reports, or give me generic descriptions of topics to help me find starting points to complete my assignments. But about 90% of the students I've talked to have cheated (sat exams together, copied assignments of past students which for my course wouldn't be flagged as it's a STEM subject and the numerical results will be the same for everyone). They are the ones who are on track of a 1st or a 2.1. The rest seem to be struggling nearly as much as I do, and the ones that don't have one thing in common, they come from upper middle class families and have had private education throughout their lives. They don't have to worry about rent, or food.

I have so many mixed feelings. Honestly, I know that I do not have the knowledge that I should from my course and probably shouldn't be able to graduate. Most lecturers are right when they say we are getting lazy. But unis can't make us pay 9k a year just to fail us. Education and knowledge is becoming inaccessible. 

I just wish uni hadn't been so expensive, so I could actually try and fail as many times as needed before I was someone who should have a degree. I want to deserve this.",User_deleted,83,negative,0
198m64t,5,2024-01-16,Recommendations on what to do about Essay Ai 🤖 cheaters,u/Irony-man-3,Teachers,https://www.reddit.com/r/Teachers/comments/198m64t/recommendations_on_what_to_do_about_essay_ai/,"So some students used chatGPT OR another artificial intelligence program to write their papers.

What would be some recommended tools or strategies to help teach students how to respond to this situation?

Students had 4 days in class to work on this assignment, 4 paragraphs, 5 grades.  One grade per paragraph and average of all four for a test grade.

I’m thinking of using an Artificial Intelligence recommendation list to enforce as their punishment, to allow for the irony to set in on not relying on artificial intelligence.  If I set the punishment it’s kind of limited… if AI sets the punishment, it would be a little bit more painful, and possibly even more meaningful.

Here’s the recommended AI LIST….

1. Mandatory academic integrity workshop: Attend a session focusing on the importance of honesty in academics.
2. Academic probation: Place the student on probationary status to closely monitor their future work.
3. Revised assignment: Require the student to redo the assignment, demonstrating their understanding without AI assistance.
4. Parental involvement: Notify parents and involve them in addressing the issue.
5. Loss of privileges: Temporarily restrict certain privileges or extracurricular activities.
6. Extra assignments: Assign additional work to reinforce learning and discourage shortcuts.
7. Written reflection: Ask the student to write a reflective essay on the consequences of academic dishonesty.
8. Zero tolerance policy: Clearly communicate that repeated offenses will result in more severe consequences.
9. Academic contract: Have the student sign a contract committing to honest academic practices.
10. Community service: Assign a community service project to instill a sense of responsibility and integrity.

For number one I was thinking maybe talk with the counselor about getting students out of sports and into a leadership class.  

What do y’all think?  What would y’all recommend?  I will be talking with admin about this.",active,6,neutral,0
1992am6,1,2024-01-17,"""ChatGPT Revolutionizing Virtual Learning: Corporate and Educational Impacts Explored""",u/cporter202,ChatGPTautomation,https://www.reddit.com/r/ChatGPTautomation/comments/1992am6/chatgpt_revolutionizing_virtual_learning/,"The advent of AI-driven technologies in education and corporate training has reached a remarkable milestone with the integration of models like ChatGPT. The possibilities afforded by such advanced systems are reshaping how we approach learning and development across sectors. 

ChatGPT, a conversational AI developed by OpenAI, has been harnessing natural language processing to provide a more interactive and personalized learning experience. In education, this means students can now have access to a tutor that is available 24/7, capable of addressing a wide array of queries in a conversational manner. Whether for understanding complex theories or for practicing language skills, ChatGPT stands as a robust adjunct to traditional educational frameworks.

In the corporate world, training and professional development take on a new dimension with ChatGPT. Onboarding processes, continual learning programs, and even skill-specific training can be tailored to individual employees, thus enhancing their engagement and efficiency. Furthermore, it facilitates just-in-time learning and support, which can vastly improve performance and problem-solving in the workplace.

However, this technological integration is not without its challenges. Questions regarding the extent of AI's role in learning, the potential decrease in human interaction, and data privacy concerns surface as we delve deeper into this domain. Additionally, the digital divide could widen if access to such technologies is not equitably distributed.

Nevertheless, the benefits ChatGPT offers cannot be ignored. By augmenting our learning environments, both educators and corporate trainers can provide more dynamic and effective teaching methods. It unlocks a horizon where the limits of virtual learning are continually expanding, and the traditional barriers of geography, time, and accessibility are incrementally dismantled.

What are your thoughts on the integration of ChatGPT in learning environments? Share your perspectives and let’s discuss the future of AI in education and corporate learning!",active,1,positive,0
1994jwa,12,2024-01-17,UMD syllabus options for AI use (from TLTC),u/joeythibault,UMD,https://www.reddit.com/r/UMD/comments/1994jwa/umd_syllabus_options_for_ai_use_from_tltc/,"When classes start next week, be sure that you understand which policy is in the syllabus!   
from [https://tltc.umd.edu/artificial-intelligence-ai](https://tltc.umd.edu/artificial-intelligence-ai) 

***Option 1 (AI for drafting):*** *In this course, you are welcome to use artificial intelligence (AI)-powered programs such as ChatGPT or Bing AI to help you create outlines or first drafts of your work. These tools can be a great starting place, and I encourage you to spend time editing your final draft into something you are proud of. It is your responsibility to verify that any information you get in these drafts is accurate and represents your own point of view well. If you have any questions about this policy and what constitutes acceptable or unacceptable use of AI-based tools, please do not hesitate to ask me -- I would be happy to talk with you about this!*

***Option 2 (some AI):*** *In this course, I encourage you to use artificial intelligence (AI)-powered programs such as ChatGPT or DALL-E to help you with some assignments. When you use these tools, it is your responsibility as a scholar to make sure you are clearly communicating the AI involvement in your work. Please make sure to use phrases such as “\[your name\] via DALL-E 2” (for images) or “This paper was generated with the help of GPT-3” (for essays). Please review the instructions in each assignment for more details on specifically how to show your work.*

***Option 3 (no AI):*** *In this course, my expectation is that you will not use any artificial intelligence (AI)-powered programs such as ChatGPT or DALL-E to help you with your assignments. Any use of AI-generated work to outline, write, create, or edit your assignments will be considered an academic integrity violation. My reasoning for this is that these programs may provide inaccurate or biased information, but more importantly, they do not serve your development as a student. In this course you will learn valuable skills from outlining, generating, and editing your own work. If you have any questions about this policy or are not sure if a resource you have found will violate this policy, please ask.*",active,13,positive,0
199gd2g,10,2024-01-17,Sharing my method for using generative AI to create quiz questions in D2L,u/qning,Professors,https://www.reddit.com/r/Professors/comments/199gd2g/sharing_my_method_for_using_generative_ai_to/,"At the end of 2022 I had students using ChatGPT to answer my short essay questions and they failed hard because of hallucinations. In early 2023 I changed the syllabus to encourage use of generative AI, and provided caveats about how their writing needs to be perfect and they are responsible for not sounding like a robot. Well that first semester sucked and I realized that I do not want to sit around reading the output of AI. 

So I have created some more complex writing assignments, intricate group interactions to force collaboration across various writing-related domains, and I am trying but I really need to figure out how to make sure these kids are doing the readings.

As much as I hate to do it, I need to quiz them. So I am using LLMs to create my quizzes for me. I create a bunch of questions and use the test bank feature to generate unique quizzes for each student (FU Chegg). My school uses D2L, and here is the prompt that I have worked out. After pasting in the text of the chapter (in my case by tearing the pages out of the textbook and scanning them) into the LLM, this is the prompt:

(I have done this in ChatGPT but am using Claude now because of the larger context window. ChatGPT requires the chapter to be broken into like ten page chunks but Claude can take the whole thing.)

(Oh, and I do not feel good about this. I actually sorta hate it. But it's necessary while I figure out how to teach in this new paradigm.)

Anyway, here it is:

*Based on that content, provide 100 multiple choice questions with four answers each in this format. randomize the placement of the correct answer among the options. it is ok if you ask questions about the same content more than once, just make sure the questions are worded differently. For the line that starts with the word feedback, please quote the relevant portion of the source; place the source quotation between the quotation marks on this Feedback line. If you create an “all of the above” or a “none of the above” answer choice, do not randomize the answer order. If you refer to the source document, refer to it as “the reading”. Please make less than 15% of the total questions have “all of the above” or “none of the above” type answers. Enclose the question and each answer is straight double quotation marks, like the example. Do not use single quotes to wrap the question or the answers.*

*NewQuestion,MC,,,* 

*QuestionText,""This is the question text for MC1"",,,* 

*Option,100,""This is the correct answer"",,,* 

*Option,0,""This is incorrect answer 1"",,,* 

*Option,0,""This is incorrect answer 2"",,,* 

*Option,0,""This is incorrect answer 3"",,,* 

*Feedback,""quote the source"",,,*

**Example of the output:**

*NewQuestion,MC,,,*

*QuestionText,“The reading states that in order to recover actual damages for copyright infringement, the plaintiff must prove:”,,,*

*Option,0,“The infringer had access to the copyrighted work.” ,,,*

*Option,100,“The extent the market value of the copyright was injured.”,,,*

*Option,0,“Both gross revenue resulting from infringement and deductible expenses.”,,,*

*Option,0,“All profits attributable to infringement are due to the copyrighted portion.”,,,*

*Feedback,“Actual damages (including lost profits, and profits gained by the infringer to the extent not counted in the copyright owner's lost profits)”,,,*

*NewQuestion,MC,,,*

*QuestionText,“According to the reading, which of the following is NOT provided as a remedy for copyright infringement under the Copyright Act?”,,,*

*Option,100,“Automatic statutory damages.”,,,*

*Option,0,“Injunctive relief.”,,,*

*Option,0,“Destruction of infringing products.”,,,*

*Option,0,“Plaintiff’s court costs and attorneys fees.”,,,*

*Feedback,“The Copyright Act provides several remedies for infringement: injunctive relief (a court order to cease the infringing activity); impoundment (court-ordered confiscation of the infringing products); destruction of infringing products; actual damages (including lost profits, and profits gained by the infringer to the extent not counted in the copyright owner's lost profits)...”,,,*",active,15,negative,0
