192401u,383,2024-01-08,When will Universities learn that AI CONTENT DETECTORS are NOT RELIABLE?,u/Revolutionary_Lock57,ChatGPT,https://www.reddit.com/r/ChatGPT/comments/192401u/when_will_universities_learn_that_ai_content/,"Here's a good one for you.

My cousin, a top grade and devoted student at a college in the Northeast, in New Jersey (said College gave birth to the ""**SCARLET KNIGH**T""), has been wrestling with a perplexing issue lately.

They've recently adopted gptzero, zerogpt, contentdectectorai, copyleaks, turnit?(sp), and a few other AI CONTENT DETECTORS to sniff out AI usage in academic papers, and it's causing chaos.

Now, here's the thing. My cousin has problems concentrating. Whether it's due to this or that - doesn't matter. I happen to be a computer programmer. You DO NOT need to be a programmer to use ChatGPT at an advanced level. My point is mentioning that, is only to say that from the perspective of a programmer, the flexibility and wide array of usage that can be utiziled from CHATGPT; its potential is amazing.

So, to help COMBAT THE WAR AGAINST AI CONTENT DETECTORS, I made a simple prompt with CHATGPT that bypassess the AI CONTENT DETECTORS. Them b\*tches.

Anyway, as a student myself, it really infuriates me that institutions have taken an active stance against AI, or ai writers, or any of those ai writing services that you have to pay a monthly fee for.

For my cousin, it helps him put together his ideas in a more coherent manner, despite his brain going in a million different directions. It helps him engage in critical thinking in putting things together, using the prompt, seeing it come out with human-like written material.

He's been immersing herself in online classes this semester, pouring hours into her essays. Here's the best part.

After handing in countless papers with using CHATGPT (thanks, remember, the the prompt that I put into ChatGPT for him to make what CHATGPT generates pass as human written content in the AI CONTENT DETECTORS) finally, the professor said that the latest paper was AI WRITTEN.

# Not the previous 20 essays, short papers, and reports that you've been receiving all this time?

We (*we go to the same school, same class)* argued with them that not only does [Originality.ai](https://Originality.ai) and all of those ai content detectors advises against using their tool for academic papers, but THEY ARE GROSSLY INACCURATE AT BEST.

# Not only did we reveal that EVERY PAPER BEFORE THIS ONE WAS AI-WRITTEN, UNDETECTED; but that I created a prompt to bypass ai content detectors.

**I told him directly.** I looked him directly, into his four eyes, and said, *""I used a free tool on the internet to beat ai content detectors. It's call chatgpt""*

# I, literally, offered to showed him the prompt. It was a phone out of my pocket, away. Chrome works fast, these days.

The professor's refusal to accommodate even a virtual meeting is another layer of frustration. She claims no office hours, working remotely. And now, with my cousin standing firm against accepting zeroes, this professor's avoidance is harrowing.

But it doesn't stop there. In a twist, we tested those murky AI detectors with various documents, including her old papers, the Declaration of Independence, and even the professor's own lessons. Alarmingly, they all registered as partially AI-written. It's a glaring flaw that's hard to ignore.

# Why can't academia understand that that AI CONTENT DETECTORS ARE NOT RELIABLE?

And what's more disheartening is the professor's stubbornness, offering half-hearted advice like avoiding Grammarly or an online thesaurus, or, a dictionary.

I'm not even sure what prompted me to share this - perhaps a mix of seeking advice and raising awareness. We're in the thick of navigating this new AI landscape, aware of its imperfections. This ordeal has been draining, to say the least.

**Why can't academia also understand that, maybe, just maybe, we can use AI to ENHANCE our education!?**",active,385,neutral,0
192hrg8,2,2024-01-09,Seeking your input for an upcoming university talk on how students can use ChatGPT effectively!,u/Rebeezel,ChatGPT,https://www.reddit.com/r/ChatGPT/comments/192hrg8/seeking_your_input_for_an_upcoming_university/,"Hello Reddit community!

I'm a professor at a university and I'm getting ready for an unconventional lecture this coming Thursday. My goal is to show my students how they can effectively use ChatGPT for their academic pursuits. I see ChatGPT not as a threat, but as a powerful tool, similar to a calculator, but one that needs to be learned and used correctly.

The central idea of the lecture is to show students practical ways in which ChatGPT can help them understand complex subjects, enhance their research or optimise their learning processes. I plan to teach them how to use this tool critically and responsibly to maximise their academic endeavours.

**I want to show the students how they can best use ChatGPT for their (social science) studies.**   
**Do you have any ideas, knowledge or suggestions that I should definitely pass on to the students?**

I look forward to your creative and informative answers!",User_deleted,2,positive,0
192lilb,60,2024-01-09,False accusations for AI use,u/joeythibault,UMD,https://www.reddit.com/r/UMD/comments/192lilb/false_accusations_for_ai_use/,"I recently read in the Diamondback that as much as a 1/3 (13 dismissed, 10 still pending) of honor council referrals for AI content were false positives. \[[https://dbknews.com/2023/11/27/umd-chatgpt-academic-integrity-cases/](https://dbknews.com/2023/11/27/umd-chatgpt-academic-integrity-cases/)\]

1. seems low based on anecdotes I've heard, probably some of the accusations are happening between a teacher and student without a referral to the conduct office
2. could be teachers take their own action with grade reductions and no formal referral

Thoughts on this? 

Are you worried about false accusations? 

A group of UMD alum/students are working on a tool for writing. While ""insurance from false accusation"" isn't a primary function, it could be used for that, and I would love to hear what y'all think.

&#x200B;",active,62,neutral,0
192n2vm,8,2024-01-09,EEE y1s1 modules review,u/HUATjj,NTU,https://www.reddit.com/r/NTU/comments/192n2vm/eee_y1s1_modules_review/,"I am so bored just one week before uni starts so I have decided to do one here after seeing modules review blogs and got inspired to do it for fun! though I am just y1s1 student from EEE.

Module Name: CC0001
Expected Grade: B
Final Grade: B+

I got C6 for O level English and D for GP, I have never expected myself to get a B+ at the end but I have always used 100% of my effort into this module, except for the presentation slides which I have generated from Canvas and just edited the words and my classmate picked the same presentation slide design as me 💀 
I also memorised my presentation script and my tutor actually feedback positively about this in turnitin because most of my classmates were reading off from their phones. Perhaps this pushed it up to a B+ (?)
I also didn't use chatgpt to generate any of my content because my tutor told us that turnitin is able to see AI generated content percentage and some students got interviewed for academic dishonesty... However, almost everyone around me used chatgpt and didn't get flagged out so I regretted not using it, could have made my life easier. My tutor is not helpful in general, very hands off but engaging in class so overall still not so bad but I hate this module with a passion even until the final submission date. 

Module Name: CC0002
Expected Grade:A
Final Grade: A

I won the jackpot of getting the best tutor, because finally there is someone who is actually passionate in teaching here and is very thoughtful and understands that half of this module is bullshit. My tutor made our workload for this mod lighter and was clear with the requirements of project submission. Though out of the 5, only me and another groupmate did most of the work but it's still not so bad as compared to doing alone so a win is still a win. We both wanted A and the rest just wanted to pass, can't get everyone on the same page so we carried our grades on our own. 
I want to thank the NTU community for sharing CC2 notes and I only studied from the notes 1 day before the quiz, just pure reading and praying because that week was hectic. I think I got around 40+ out of 50 for the MCQ and overall I think I got 80+ % from predicting. Overall, my prof carried this mod, I enjoy going to his class too but hate the mod due to how useless it is.

Module Name: EG1001
Expected Grade: A-
Final Grade: A-

I got teammates who did not reply to my texts but thankfully I got another teammate who wanted an A so a win is still a win, my prof is okay, lenient in class part, just have to ask some questions and he did not record our attendance, so I turned up only 4 times to ask 4 questions with 2 of it on my presentation week and the other 2 when I felt like it. I gave my QnA questions to my classmates who wanted class part so QnA was always a breeze and likewise my classmates gave me questions to ask so teamwork! I hate the online quiz though so little time for us to think... I guessed like half of the questions and was not confident with the guessing... Probably why the A- too... or maybe I didn't attend most of the classes. Did not attend or view any of the lectures because I slept through the lecture in week 1! I want to thank the NTU community once again for sharing EG1001 notes too!!! Studied 3 days for this quiz due to the sheer content... I'm not proud of this but yes. Content is really boring and only useful to a certain extent but i forgot most of it already so it's useless.

Module Name: PH1011
Expected Grade: C/C+
Final Grade: Dabao/LOA

I got 100% for both Mastering Physics and Learning Catalytic because I copied them from a friend, it was so time consuming and I just thought of ""copy first, get 100%, study later"" Well I copied and got 100% but I didn't study later so I have no idea whats going on. I did not view lectures or tutorials. I did not attend tutorials. It was way worse than H2 Physics because they added new content on top of what we had known and we had to finish 1.5 years of JC physics content within one sem, some topics like nuclear physics, quantum, AC were excluded. Failed two quizzes got 26/55 and 28/60 and couldn't do any questions in pyp a day before finals so I dabao-ed. Yes, I couldn't do Krichoff Law even at the end... I deserved it 100%

Module Name: IE1005
Expected Grade: B+
Final Grade: A-

First half of the module (before recess week) was easy, got 90+ for Practical Exercise and Test, second part was hell, and i got a shit prof for second half, got 80+ for Practical Exercise 2 and 60+ for Practical test 2 that was 25% ... Quiz was hard because I have always relied on system output until they asked me to crack my brains for output... I was screwed, because the questions come in part a ,b and c and if you cant do part a, you may not be able to do the rest of the parts and you have 5 choice's instead of 4 so your chances of guessing the correct one drops. I hate this module during the second half and C programming language just don't seem useful to my current projects as compared to python or Arduino.

Module Name: MH1810
Expected Grade: B+
Final Grade:A-

I did not attend a single tutorial class... It was early in the morning...Mid term I had gotten a 14/16, I thought I screwed it up but I managed to guess some questions correctly using GC so important to have GC with you. Online components are easy to get 100% with the right support from friends. For the finals, I couldn't do 2 full questions, and it was blank but I attempted the rest. Thought I would have gotten B+ at best but bell curve was on my side and managed to scrap a A- , I hate this mod because of the long sentences I have to write and prove concepts... but overall still okay because questions are mostly the same standard compared to pyps

Module Name: FE1073
Expected Grade: A-
Final Grade: A-

I do love the hands on part of this lab though, but the report is so difficult for CEE lab and I managed to get some resources to students lab reports so I would prepare in the morning before heading to the lab, I think I got an A- instead of A was because my numbers were always so off and doesn't make sense but questions like sources of error or calculate percentage error were easy to score so it balanced it out

Got 4.5 gpa on the dot or 4.0-4.1 if I did not dabao PH1011. I suggest dabao if you don't want to tank your gpa so soon, it kills motivation (to me) at least I may have another semester to wake up and buck up but I still think I would do badly for PH1011 though. Hope I fall down and become smarter or something",User_deleted,15,neutral,0
192rtlf,2,2024-01-09,need som advice - Relying Heavily on AI for Coding,u/Typical-Long-5686,AskProgramming,https://www.reddit.com/r/AskProgramming/comments/192rtlf/need_som_advice_relying_heavily_on_ai_for_coding/,"Hey everyone,  
I'm a graduating student struggling with a dilemma that's been bothering me lately. I find myself relying extensively on AI tools for my coding projects, and I'm worried it might not be the best approach for my development as a programmer. I'm not sure if this reliance on AI will become the norm in the future(10years from now), but I'd like to discuss whether it's a bad practice, especially as someone who's about to enter the professional field.  
Here's a glimpse into my process: I have a basic understanding of programming fundamentals, and I tend to grasp new concepts quickly, but I often struggle with the practical application. When I start a project, my approach involves piecing together tutorials, snippets from existing codebases, and often uses AI (like ChatGPT) to fill in the gaps or solve errors.  
For instance:  
 1.) I search for tutorials or similar projects and incorporate parts of their code into my own.  
 2.) If I need a specific function or solution, and I can't find it readily available, I turn to ChatGPT to help tailor or create that function for me.  
  3.) When the different code snippets don't align or produce errors, I again rely on AI to troubleshoot and make them compatible.  
basically all my codes are snippets.  
This cycle continues until I complete the project, with ChatGPT often assisting in making the code cleaner, more reusable, and easier to manage.   
While this approach gets the job done, I can't shake off the feeling that I might be taking shortcuts and not truly learning or growing as a developer. I understand how the code works, but I worry that relying too much on AI might hinder my growth and independence in problem-solving.  
I'm open to any advice, opinions, or constructive criticism. Has anyone else experienced a similar reliance on AI tools in their coding journey? What are your thoughts on this approach, especially considering its implications for someone entering the professional field?  
I appreciate any insights or guidance you can provide. Thank you.",active,3,negative,0
