18vsuno,1,2024-01-01,Why is academia so miserable?,u/Round_Soup_8872,gradadmissions,https://www.reddit.com/r/gradadmissions/comments/18vsuno/why_is_academia_so_miserable/,"Title. 

I applied to PhD programs this cycle, and am currently completing my undergrad degree. I have enjoyed the community work side of academia, which has been really present throughout my time at my undergrad university. That’s a large part of why I decided to pursue grad school. But, especially when I hear people talk about grad programs and their experiences as a grad student, it seems so harsh and miserable. I just don’t understand why the environment has to be so cutthroat, bitter, and harsh, especially when no one’s really making much money or getting famous off of the work anyways? 

I made the mistake of going through r/Professors and, honestly, I’ve never seen a group of teachers express more hatred for their students (according to them, everything is written by ChatGPT, even short emails, and every student is a grade grubber looking for a cheap diploma). But — while I’m certainly not an unbiased source, being an undergrad myself — I know so many other undergrads who really love their classes and their coursework, and who have been drilled down by the sometimes pretty toxic environment that is academia. I don’t see why these people continue to teach (except for maybe not having any other viable career path) if they genuinely see no value in the classroom and the work that happens within it. 

Ultimately, do I even want to be in a grad program ran by people who hate their students (both grad and undergrad)? I understand that students’ antics can get draining, and I know I myself have been a pain to my profs at times, but undergrads also put up with a decent amount of BS from their professors. ChatGPT absolutely is a threat to the education system, but by no means is every student using it. I once saw my professor at a department party after she lied to our class about being deathly ill. Her cover-up story was a lie, sure, but it was funny, too. At the end of the day, I think it’s reasonable to expect a small amount of patience, care, and understanding from both parties.

Ultimately, maybe it’s not worth it to keep on this track. I don’t want to see academia as a sinking ship, but there already seems to be plenty of people already aboard the ship that wish to see it sunk (if that metaphor makes any sense at all). I’m just disappointed and tired (and in my opinion, unnecessarily so). There’s no reason why academia should feel like an underground dog fight.",User_deleted,3,neutral,0
18vwlr8,1,2024-01-01,Ideas for a New Coding Benchmark,u/Dry_Long3157,LocalLLaMA,https://www.reddit.com/r/LocalLLaMA/comments/18vwlr8/ideas_for_a_new_coding_benchmark/,"Hey guys, 

I find most benchmarks useless and the top models on the Huggingface benchmark that have scores that are as good as (if not more) GPT-4 prove to be significantly worse in my day-to-day uses. I decided to test a few models of different sizes on prompts that I would use in my daily use to see how useful each of them are to the end user (please find the chart attached for the relative scores).   


https://preview.redd.it/7y15qjhbvt9c1.png?width=759&format=png&auto=webp&s=bf2250de1751e44dadc836096e516243e23652c2

Prompts used - 

1.  Give me code for a python function that takes a list of website urls and downloads the css, html and js files for each website in a separate folder with the same name as the website.  
2. Give me a python function that takes in a list of urls, it should open each url in a browser and capture the screenshot of all the sections of the landing page of the website and save them to a folder named after the website visited. Each website gets a folder and make sure all the parts of the landing page are captured.
3. Give code for a python script that can read the latest news on a given topic and summarize all the information and then perform text to speech on the summary to read it out. 
4. Create a Python application that generates personalized diet plans based on user inputs and machine learning predictions. The application should interact with the user to gather data such as age, weight, height, dietary preferences (vegetarian, vegan, etc.), allergy information, fitness goals (weight loss, muscle gain, maintenance), and any medical conditions (diabetes, hypertension). Using this data, the application should employ a machine learning model (which you will need to train using an appropriate dataset) to suggest a weekly meal plan that meets the nutritional requirements and personal preferences of the user. The meal plan should include meal timings, recipes, calorie counts, and macronutrient breakdowns (proteins, carbohydrates, fats). Give me only the code for this.
5. Develop a real-time collaborative code editor similar to Google Docs for software developers. This editor should allow multiple users to edit the same piece of code simultaneously from different locations. The editor must support syntax highlighting for at least three programming languages (e.g., Python, JavaScript, Java) and provide a live preview of the output, if applicable. Moreover, the application should integrate a basic version control system where users can save different versions of the code, write commit messages, and roll back to previous versions if needed. The system should handle conflicts when two users attempt to modify the same part of the code. Give me only the code for this.

I used the Divine Intellect preset for all the open-source models and used ChatGPT-4 to score each of the response using this prompt - ""Grade the submission of these students out of 10 as if this was part of an python coding examination."", I replaced the model names with Student 1, Student 2, and so on. I understand that using GPT-4 for scoring isn't the best way but it was the best that I could come up with (Let me know if there are better ways).   


I aim to collect 100-200 prompts that are related to code generation and based on things users generally use these models for. So please let me know if you have good prompts that I can add to this set. I also think not making these prompts public is the only way we can ensure that the models aren't just trained on these responses to give better results on benchmarks.   


Let me know what you guys think! 

&#x200B;",active,7,neutral,0
18w2r6y,1,2024-01-01,High Level Curriculum,u/AARPCardinRoute,Teachers,https://www.reddit.com/r/Teachers/comments/18w2r6y/high_level_curriculum/,"The r/school welcomebot messaged me saying “other educational stakeholders are free to view and join discussions (here).” 

I am completely unsure if I am an “educational stakeholder” since I do not hold a teacher/ tutor position - of any kind. Nor do I have any kids that attend an accredited school. 

All I am is an interested, curious spectator. 

Been that spectator since 2022 - the year DOE’s [Miguel Cardona told the NYT](https://www.nytimes.com/2022/10/24/us/math-reading-scores-pandemic.html?smid=nytcore-ios-share&referringSource=articleShare) he was upset about the National Assessment (of) Educational Progress (NAEP) ’s findings. 

As for that headline: I blame the lack of support from parents (of students who behave poorly) and all the way up to state/ federal level individuals who can assist districts but decide not to. And a good runner-up to that are the  administrators who view change as a bad thing for their school(s). It’s clear that what’s in place isn’t really working and yet they hinder  thier teacher’s new ideas/ concepts for the class. And they wonder why there is a shortage of teachers. 

That’s the main reason for the drop in reading/ math levels. Feel free to change my mind there lol. 

Back to the post: I find it extremely difficult to sift through/ organize all online information about the current education system (currently sub to the Chronicle of Higher Education {they barely touch on K12 stuff so I’m ending this} and some Teacher/ Professor Substacks) we have in place. 

My goal is to have a bird’s eye of view / macro of the system. 

You would think ChatGPT would assist in that department. But even that doesn’t seem to get me the particular information I am seeking. 

So now I’m here. 

I actually created this post because I believe that curriculum plays a big role in schooling. From my understanding curriculums are a bunch of roadmaps that take a student with no knowledgable structure to one with a knowledgeable structure. One that can be used in work and or for higher education. 

Could you describe your take on curriculums?

Does it follow the common-core? State requirements? Your school’s requirements?",active,2,neutral,0
18wb3md,1,2024-01-01,"Challenged by a student on evolution, need a response ASAP!",u/Answermethis101,CanadianTeachers,https://www.reddit.com/r/CanadianTeachers/comments/18wb3md/challenged_by_a_student_on_evolution_need_a/,"This is for the science teachers out there.  

If one is teaching Evolution, and is challenged by a student on the veracity of it, how should one respond?

For example, specifically, a student who poses this multifaceted question:

""Teacher, if the \[ape theory\] is true, and macro evolution is true, why is there no proof of one species changing to another species anywhere in human recorded history, especially the last 200 years?  Why are there no transitional fossils?  Are you asking us to have blind faith in this unproven theory?""

Or this question:

""How did A-sexual cells become sexual cells and with what did they reproduce with?""

&#x200B;

I have no answers to these questions and neither does ChatGPT.  Please help!

&#x200B;",User_deleted,0,neutral,0
18wenv4,1,2024-01-01,"GPT-4 responses are short & unhelpful; accuses me of lying, and refuses to give me Open AI's support email",u/iDoWatEyeFkinWant,ChatGPT,https://www.reddit.com/r/ChatGPT/comments/18wenv4/gpt4_responses_are_short_unhelpful_accuses_me_of/,"I'm sure everyone has already reported this, but it's gotten so bad to the point I cannot use my premium ChatGPT account for anything.

When I finally asked for the Open AI support email, it refused to give me that, too.

It refuses all of my prompts and only gives short, indirect answers. When I asked for a longer answer, it straight up said ""No,"" and that it would be considered academic assistance.

I'm not a student nor using ChatGPT for professional services. I told it who I was and why I wanted the information, but it didn't believe me.

In each of its short, incomplete answers, it would tell me to search the web myself to learn more.

It doesn't matter how I word my prompts or build custom GPT's. It literally just does whatever it wants to and disregards my instructions now.",User_deleted,0,negative,0
18wshab,1,2024-01-02,Build amazing AI projects with Google’s Gemini models and Python,u/Quirky-Low-7500,Python,https://www.reddit.com/r/Python/comments/18wshab/build_amazing_ai_projects_with_googles_gemini/,"Hi everyone,

I’m excited to share with you my repository of Python projects and ideas that use Google’s latest and most powerful generative AI models: Gemini-pro and Gemini-pro-vision. These models can perform various tasks such as text-to-speech conversion, interactive chat, image and video processing, and content generation.

With my repository, you can:

* Convert any text into natural-sounding speech with Gemini-pro
* Chat with a friendly and engaging AI assistant powered by Gemini-pro-chat
* Recognize and analyze images and videos with Gemini-pro-vision
* Generate diverse and dynamic content such as poems, stories, code, essays, and more with Gemini-pro

My repository also provides educational insights and project ideas for students and researchers who want to learn more about Google’s Gemini models and their applications. You can explore the limitless possibilities of AI with Gemini and embark on a journey of innovation and discovery.

If you are interested, please check out my repository here: [https://github.com/GitCoder052023/Build-with-Gemini](https://github.com/GitCoder052023/Build-with-Gemini)

I would love to hear your feedback and suggestions on how to improve my projects and ideas. Feel free to leave a comment or open an issue on GitHub.

Thank you for your time and attention. I hope you enjoy building amazing AI projects with Gemini and Python. 😊",active,6,positive,0
18x5u8f,1,2024-01-02,Revenge: My friend robbed me - I have proof they plagiarized A LOT,u/Strong-Scarcity-6382,Advice,https://www.reddit.com/r/Advice/comments/18x5u8f/revenge_my_friend_robbed_me_i_have_proof_they/,"**The situation:** Essentially, I left a very expensive laptop (>$2000) at friend's place for a few weeks because I had to leave the country suddenly due to family illness and couldn't take it with. We'd been friends for ages and I thought I could trust her. Cut to yesterday, I came to pick it up and she said it's gone and someone must have stole it. However, I have proof from another friend that she actually sold it. I feel enraged, but I know for a fact that the police in our country will do nothing about this. In addition, I have no money for a lawyer - so legal routes of revenge are out. 

**Here's what I've got to work with:** I shared my OpenAI account with this person early last year, and they've been using it ever since to complete their Masters coursework and thesis. Like, basically every assignment they wrote has been pure ChatGPT. Currently I have 9 separate examples of ChatGPT logs relating to coursework (e.g., ""write a 9 page paper about x""), and 17 examples of ChatGPT logs relating to her thesis (e.g. ""create a survey to measure well-being"", ""write a paragraph on why x research topic is important"", ""fill out this ethics approval form""). The university is terrible and the professors are underpaid, so I guess they don't bother checking much for AI use which is how her plagiarism has so far escaped notice. I figure since I have the logs for all her prompts and ChatGPT's responses (which are essentially identical to her assignments), if I send this information to her advisor and the department's disciplinary committee lead, it will presumably cause her to be reprimanded in some way. I genuinely don't know if they would slap her on the wrist, fail her for a few subjects, or suspend her from the program. 

**Here's some considerations:** 

\- *She's still using the ChatGPT account* for uni, and doesn't know I'm considering this revenge. So, I'm wondering if I should hold off on giving this information to the university until she has used ChatGPT for more coursework or for her actual thesis (she hasn't started yet, but when she does I know she will use ChatGPT). This way, there would be even more damning evidence of plagiarism.

\- She has a pet dog who I love and want the best for, and I'm worried that if I fuck up her degree I'll be making life worse for this dog. The dog would certainly be better off if she gets her MA on time this Spring instead of potentially missing her chance at jobs and PhDs. I am genuinely considering not doing any of this out of sympathy for the dog. 

\- She might find out I did this, and try and get revenge on me. I don't want to start a blood feud. 

\- Snitching is a fu\*\*ed up thing to do, and I don't take it lightly. Even though she lied and stole, it is not in my nature to snitch on anyone and I have never taken revenge on anyone in this way before. It will cost me sleep in future if I go through with this. However, not going through with this would also cost me sleep as I am not a forgiving person and I know the only justice in the world is the justice we create. 

**How can you help me?** Tell me, if you think I should go ahead with this, how I can maximize the damage. Tell me what kind of additional proof, if any, I should send to the university aside from shared ChatGPT logs (I'm using the Share Conversation function built into ChatGPT). Tell me who I should send it to aside from her advisor and the head of the disciplinary committee (What about the head of the department? Surely there is a limit to the number of people I should send this info to?). I am a PhD student in another program where plagiarism is taken very seriously, but I know that at her university they don't really care. Students have been caught before by Turnitin or teacher intuition, and they've been given slaps on the wrist. Do you think I can be confident that if I send this proof of *extensive* plagiarism, *something* will happen? 

tl;dr: A person I thought was a trusted friend betrayed me badly, but I have proof she used ChatGPT to submit a ton of work for her MA and MA thesis. I am now considering sending this to her university as a form of revenge. 

&#x200B;",User_deleted,1,negative,0
18xa6jf,1,2024-01-02,How do I learn more about LLMs?,u/OvercookedSatellite,LocalLLaMA,https://www.reddit.com/r/LocalLLaMA/comments/18xa6jf/how_do_i_learn_more_about_llms/,"Hi, so short story I don't really know much about LLMs. I've made a few posts here and I've managed to get SillyTavern running with oobabooga, automatic1111, tts and image captioning so it all works pretty well, I'm even using ngrok to get the port to open under a domain so that I can use it anywhere in the world (I tried it and it works pretty well).

Of course the problem now is the text generation, while my model works, it is far from being the best, and I'm trying to find a new one that's better but without compromising my generation times (so far, seems like an impossible task).

I sort of got the hang of what certain things are in LLMs like parameters (3B, 7B, 13B,...), but everything else is still a bit confusing (transformers, Llama, generation configurations, etc...)

I have a laptop so obviously not the best thing to run a LLM, even though it is a pretty good laptop. So that's why picking a model isn't exactly easy. Thus I feel that learning more about this would help me, especially since I am a CS student so I need (and want) to learn about these things.

But I've done some googling but I can't find any good resources to give me an extensive breakdown of the whole thing. Any help? :')",User_deleted,12,neutral,0
18xa8c8,1,2024-01-02,Mathematically Improve Your Trading Strategy: An In-Depth Guide,u/NextGen-Trading,ArtificialInteligence,https://www.reddit.com/r/ArtificialInteligence/comments/18xa8c8/mathematically_improve_your_trading_strategy_an/,"I used to be a Category 1 trader. You see, in this world, there are 3 types of traders. Category 1 is The Uninformed Investor, or the WallStreetBets Yoloer. These traders ride the waves of popular opinion, often finding their strategies in the most upvoted posts on forums like /r/WallStreetBets. Their approach is akin to gambling, relying more on luck than analysis. They lose money consistently, and never seem to learn from their mistakes; they blame “the Market Makers” for “rigging the market against them”.

Eventually, realizing that I’d have better luck going to Vegas, I evolved into a better trader. Let’s call it Category 2: the independent systematic trader. Oftentimes, these types of folks used to be WallStreetBets Yoloers, but have learned the hard way that following the crowd doesn’t work. These traders often maintain trade journals, reflecting on their decisions to improve future strategies. Embracing technology, they often use APIs for efficient trading. However, when faced with unpredictable market movements, emotions can still cloud their judgment, leading to panic-driven decisions and regret when the market eventually stabilizes.

Many people quit after this stage because they are still unprofitable. But those that make it through evolve to the final category of traders: Category 3: the algorithmic trader. This trader doesn’t just use computers to execute their trades; they use computers to formulate them. They understand strategy optimization, how to prevent overfitting, and how to make their strategies generalizable. They understand that the best way to beat the market is to have a rigourous systematic approach. They use backtesting to confirm their hypothesis, and then paper-trade after they think they’ve developed an edge. When their portfolio drops suddenly, they don’t panic, because they understand that it’s mathematically impossible to win every single trade. These are the traders that are profitable when the year ends.

There’s a common misconception that you have to be a MIT PhD student to become an algorithmic trader. But this is far from true. Thanks to the advent of Large Language Models, anybody with a computer and wifi and learn to become an algorithmic trader. This article will show you exactly how.

Read the rest of the article here! Comment below what you think.",User_deleted,0,neutral,0
18yiodc,1,2024-01-04,Leveraging ChatGPT for Enhanced Data Analysis and Reporting in Various Industries,u/cporter202,ChatGPTautomation,https://www.reddit.com/r/ChatGPTautomation/comments/18yiodc/leveraging_chatgpt_for_enhanced_data_analysis_and/,"The integration of AI language models like ChatGPT into data analysis and reporting has been a game-changer across multiple industries. Let's deep-dive into how leveraging ChatGPT has the potential to enhance these crucial tasks.

One of the standout benefits is the ability of ChatGPT to understand and process natural language. This allows it to work with unstructured data, which is prevalent in industries like healthcare and social media. By converting this data into structured insights, it drastically reduces the time analysts spend on data cleaning and preprocessing.

ChatGPT's capacity for generating human-like text also streamlines the reporting process. It can assist in creating comprehensible and detailed reports from complex datasets, making the findings more accessible to stakeholders who may not be data-savvy. This reduces the need for extensive training and enables quicker decision-making.

In finance, ChatGPT can be used to parse through large volumes of financial reports and news articles, identifying trends and key information that can influence investment strategies. It can digest earnings reports, SEC filings, and market news, providing a synthesized report that highlights the most critical information for analysts.

In the retail industry, ChatGPT can analyze customer feedback, reviews, and social media to offer insights into consumer behavior and preferences. Retailers can then tailor their products and marketing strategies accordingly, leading to improved customer experiences and increased sales.

Furthermore, in the realm of logistics, ChatGPT can optimize reporting by analyzing transportation and delivery data, identifying patterns that can improve supply chain efficiency. This can help companies to minimize delivery times and costs, directly impacting their bottom line.

Manufacturing can benefit too, by using ChatGPT to monitor and interpret sensor data from production lines. This enables predictive maintenance and helps in avoiding costly downtime by alerting staff to potential issues before they escalate.

In the realm of scientific research, ChatGPT can sift through numerous research papers, summarizing findings relevant to ongoing studies. This allows researchers to stay abreast of the latest developments without wading through volumes of literature.

Lastly, the education sector can utilize ChatGPT to provide personalized learning experiences, using data analysis to understand student performance and adapt teaching methods accordingly.

Overall, the adoption of ChatGPT for data analysis and reporting promises to make data-driven insights more accessible, enhance strategic decision-making, and provide significant competitive advantages across various industries. It is not just about data crunching but also about transforming data into narratives that can drive business value. Are you already leveraging ChatGPT in your field? Share your experiences and thoughts on how AI is reshaping industry standards for data and reporting.",active,0,positive,0
