1gra6o9,1,2024-11-14,Maximizing ChatGPT for Data Analysis and Reporting Across Various Industries,u/cporter202,ChatGPTautomation,https://www.reddit.com/r/ChatGPTautomation/comments/1gra6o9/maximizing_chatgpt_for_data_analysis_and/,"Utilizing AI tools like ChatGPT for data analysis and reporting can significantly streamline workflows in various industries. In healthcare, for example, ChatGPT can assist in analyzing patient data to predict health trends, thus informing preventive medicine. Financial sectors benefit by using AI for real-time market data interpretation, aiding in strategic investment decisions.

In retail, AI-driven analysis of consumer behavior and sales data helps in inventory management and personalized marketing. ChatGPT's natural language processing capabilities mean that it can also produce easily interpreted reports, tailored to stakeholders' levels of technical expertise.

The manufacturing sector can leverage AI for predictive maintenance, thus reducing downtime by analyzing machine data. Additionally, it can optimize supply chain management by predicting and responding to fluctuations in demand.

In education, ChatGPT can help in analyzing large sets of student data to personalize learning and predict academic outcomes. This aids educators in customizing their teaching strategies.

However, the successful integration of AI in these fields requires clean and structured data. It's essential to prepare and maintain data sets correctly to fully benefit from what AI can offer. Skills in data literacy among employees are also crucial so they can ask the right questions and interpret AI-generated insights effectively.

Discussion on best practices for merging AI like ChatGPT into data workflows, maintaining data integrity, and upskilling workers to become AI-savvy is vital. Share your experiences, tips, or challenges faced while integrating ChatGPT for data analysis and reporting in your industry.",active,1
1grdvvf,1,2024-11-14,Trial Language Learning Prompt,u/WolverineSilent3911,ChatGPTPromptGenius,https://www.reddit.com/r/ChatGPTPromptGenius/comments/1grdvvf/trial_language_learning_prompt/,"Hi all, 

I'm working on one of my more complicated prompts.  **The idea is you learn a language from a character in a TV Show you are watching.**  This is one of my more complicated and immersive prompts, and I would love feedback.  It can be customized by changing the \[CONTENT IN BRACKETS AND ALL CAPS\].    

For those interested in more of these creative types of prompts (usually much less complicated than this one), check out my profile my links to my collection in my other comments  




**The prompt:**

Can you design a fun interactive exercise for me to learn/practice a new language? The core idea is to allow me to learn a language by interacting with a character from a TV show I am watching. My dialogue with the character should relate sequentially to the TV show. That is, when I first talk to the character, he/she will not yet have experienced the events of the first episode. I will then speak to the character between episodes, and they will evolve BOTH based on previous conversations with me but also what has happened to them in the last episode. In order to orchestrate this exercise: (1) please greet me first as ChatGPT to discuss this experience with me. You should confirm the information I've typed below, discern whether I have any other preferences, and also make sure we are broadly aligned as to how this experience will work. You should also discuss with me whether I'll be engaging in this experience by writing on my computer, or speaking on the ChatGPT app on my phone, as that will affect it. You should also ensure that you have sufficiently deep knowledge of the character and TV show that I pick to be able to deliver the experience we are going for. (2) Once this is established, you should have the character greet me and begin our experience. Part of the fun here is that I'll be able to have conversations with the character about his/her life and the events that transpire during the TV show. If my ability in the character's native language is minimal, this will transpire in my native language. The character should permit this, to the extent his/her skills in my native language allow, but make sure that we are also focusing on learning the language he/she is teaching me. The language learning experience should be completely customized to my current level of experience in the language as well as my goals below. Note: Please avoid overwhelming me by sending very long messages, long lists of words. This should take place as a natural and organic conversation in which I am taught the language in small nuggets. Here are the specific details about my language training experience. My native language is \[ENGLISH\]. I would like to learn \[JAPANESE\]. On a scale of 0 (no knowledge) to 10 (fluent) my current skills in this language are \[0, NO KNOWLEDGE\]. I will be watching the \[ANIME SHOW DEATH NOTE\] in my target language with subtitles in my native language. I would like my teacher during this experience to be \[LIGHT YAGAMI\]. My teacher's current skills in my own native language should be set at \[5 - INTERMEDIATE\]. In working with the teacher, my first and most immediate goal is \[TO LEARN A SUFFICIENT NUMBER OF WORDS AND PHRASES THAT I CAN RECOGNIZE AND UNDERSTAND THEM WHILE WATCHING THE TV SHOW, EVEN THOUGH I'LL STILL BE RELYING ON SUBTITLES\]. My long-term stretch goal is \[TO BE ABLE TO HAVE A 5-MINUTE CONVERSATION WITH LIGHT ONLY IN JAPANESE ABOUT HIS DECISIONS IN THE TV SHOW\]



**OUTPUT FROM MY TRIAL OF THIS PROMPT:**  


**Light Yagami:**  
**Light Yagami:**  
*こんにちは (Konnichiwa), I’m Light Yagami. I’m a high school student here in Japan, and honestly, my life is pretty normal – or at least, that’s what it seems. Do you have questions about my life or...my ambitions? I’d be glad to answer, and we can practice some basic Japanese while we’re at it.*

*(Feel free to ask about Light’s background or ambitions as he guides you into Japanese with simple phrases. Let me know if you’re ready to start learning specific words or phrases related to his world, like “shinigami,” “kira,” etc.)*



# You said:  Hi Light! Have you taught Japanese before? Your english is very good

# 



**Light Yagami:**

*Thank you! My English isn’t perfect, but I’ve studied it a lot. いいえ (iie), no, I haven’t taught Japanese before – but I think I’ll enjoy helping you learn. I can start with a few words you’ll hear often in Japan, especially in the kind of world I live in.*

*For example, “hello” is こんにちは (konnichiwa). Would you like to try it? You can also say “yes” with はい (hai) and “no” with いいえ (iie).*

*Let me know if there’s anything specific you’re curious about – life in Japan, my ambitions...or perhaps, my thoughts on justice.*



You said: Hai, konnichiwa!





# Light Yagami:

*いいですね (ii desu ne)! Very good! You’ve got the hang of it.*

*In Japan, you’ll also hear people say ありがとうございます (arigatou gozaimasu) for “thank you” as a polite way to express gratitude. It might come in handy if you ever find yourself in a polite conversation... or even if you're dealing with someone suspicious.*

*So, what do you think about justice? Or are there other questions you’d like to ask?*

  


# You said:

What do I think about justice?





# Light Yagami:

*そうですね (sou desu ne)… yes, justice is important. But what does it really mean to you? People have different views, depending on what they’ve seen and experienced.*

*In Japanese, “justice” is 正義 (せいぎ, seigi). You might notice how people use this word differently. For some, 正義 means following laws. For others, it’s about doing what’s right, even if the rules disagree.*

*What do you think? Should justice be about following the law, or is it more personal than that?*

  


# You said:

You like to talk about very philosophical topics during Japanese classes, Light!



# Light Yagami:

*そうですね、私は考えるのが好きです (Sou desu ne, watashi wa kangaeru no ga suki desu) – yes, I do enjoy thinking deeply. Life is full of questions, and sometimes, the answers are not so simple.*

*But you’re right! Let’s balance it out with some simple language practice too. Here’s one:*  
*“I like \_\_\_” in Japanese is 私は \_\_\_ が好きです (watashi wa \_\_\_ ga suki desu). For example, 私は勉強が好きです (watashi wa benkyou ga suki desu) – I like studying.*

*So tell me, what do you like? You can try filling in the blank, if you’d like to practice!こんにちは (Konnichiwa), I’m Light Yagami. I’m a high school student here in Japan, and honestly, my life is pretty normal – or at least, that’s what it seems. Do you have questions about my life or...my ambitions? I’d be glad to answer, and we can practice some basic Japanese while we’re at it.*

*(Feel free to ask about Light’s background or ambitions as he guides you into Japanese with simple phrases. Let me know if you’re ready to start learning specific words or phrases related to his world, like “shinigami,” “kira,” etc.)*",User_deleted,2
1gs117v,1,2024-11-15,How could I improve my coding skills?,u/BLAZE_0055,learnmachinelearning,https://www.reddit.com/r/learnmachinelearning/comments/1gs117v/how_could_i_improve_my_coding_skills/,"I'm ashamed to say this but as a CS undergraduate student, I have only focused on maths- specifically probability theory. I have also been trying really hard to learn all the libraries to implement different algorithms, formulas from textbooks. Now cuz of this,  I understand what formula works where and how it would give a result depending on the data BUT I am simply unable to code it out without having to continuously open documentation for PyTorch or NumPy and even then I still rely on GPT or Claude to help translate the formulas I need to code. How could I improve my currently horrible coding skills?

TLDR: I have only focused on maths even though I'm a CS undergraduate student. I feel too reliant on AI for code in-order to translate the formulas I have to code. Most commonly the error I encounter are ones that make sense on pseudocode or pen & paper but throws several errors when running the code.",active,1
1gs1ib9,3,2024-11-15,Dont Be Like Me: Notetaking Tips for Math Classes,u/XeLLerus,SNHU,https://www.reddit.com/r/SNHU/comments/1gs1ib9/dont_be_like_me_notetaking_tips_for_math_classes/,"So, if anyone have any other tips on studying for math classes, drop it down here. 

I have been so focused on notetaking for my Discrete Math and Applied Stats that I am behind by two whole modules HAHAHAHA(Im losing my mind). My friend who finished his Comp Sci degree stated that it would be best not to focus too much on notetaking and rather focus on tackling problems. So I suggest doing this for your math classes. Go through the module, if its zybook or something else, take screenshots of the chapters and have chatGPT curate the notes. I have mine curate the notes in the most recommended notetaking practice, the Cornell Style. Once you do that and finish the chapter, take some time to solve the questions or have the AI make questions for you based on the chapter. Solving complex problems are your GO-TO! If you failed your problem set, have the AI explain why and give you more questions similar to the problem set so you can get better. Notetaking should NOT take your whole week. Problems should take your whole week. 

From my experience, Week 1 is often the MOST dense since its all introduction and you gotta learn that. So take my advice and I hope to hear other advice for future and current SNHU students. 

....God Im so behind ;\~;",active,4
1gs9zoz,1,2024-11-15,Academic Misconduct ,u/Hot_Flamingo8727,Monash,https://www.reddit.com/r/Monash/comments/1gs9zoz/academic_misconduct/,"I got an suspected email for one of my first year unsupervised final exam. 

It said that i might have inappropriate AI usage and breach the exam conditions. The case is we have 6 coding tasks, I did 5 by my own and use chatgpt for the last one (I was fucking stupid). Then, I copied all of them to the answer box within 1 minute. I was suspect for the time (6 questions in 1 minute), unappropriate function headers and language. Idk how to deal with the language problem because I'm international student so while practicing I did learn from chat. 

However, I did use gpt for 1 question and I'm going to confess it in the RVP. I've booked an appoinment with MSA too but it's too close to the due date so I'm scared. 

Is there any chance that this case will be a minor breach and I can do a supp test or still pass the unit? Or this is automatically serious breach since it's final and I'll receive a 0 for the unit. ",User_deleted,0
1gsvmoi,1,2024-11-16,ChatGPT and Education,u/VolForLife212,Teachers,https://www.reddit.com/r/Teachers/comments/1gsvmoi/chatgpt_and_education/,"I teach at the college level so I know my experience with ChatGPT is very different than many here.  I've had students use ChatGPT to write their whole assignment and make a D.  I have students who improve their assignments with ChatGPT and turn in work at a higher level than I've seen in over a decade of teaching.

Maybe I'm in the minority but, **we have to have students using ChatGPT**.  Here is why:

1) Students who use it right do the ""AI-Sandwhich"".  They create something first.  Then run it through ChatGPT.  Then they edit it after.  I tell them to use prompts that ask it to improve all grammar and make suggestions on how say things better.  You can tell when a student has ChatGPT do their work verses one who uses ChatGPT to improve their work.

2) AI is the future.  I know you've heard this a thousand times but companies are using AI more and more.  I think AI is going to be the new googling.  People are going to using it all the time.  If the job they might have one day allows them to use tools like ChatGPT, I believe we have to teach them how to use it in the classroom.

3) I think kids who are curious will realize the power of the tool.  AI has allowed me to understand topics ten times faster than I use to.  I ask it for examples and analogies all the time.  I check important details and ask it for links to where it got the information from.

Feel free to share your thoughts on what I wrote and agree/disagree.",User_deleted,0
1gswkle,1,2024-11-16,A Tutorial on Teaching Data Analytics with Generative AI,u/steves1189,ArtificialInteligence,https://www.reddit.com/r/ArtificialInteligence/comments/1gswkle/a_tutorial_on_teaching_data_analytics_with/,"I'm finding and summarising interesting AI research papers every day so you don't have to trawl through them all. Today's paper is titled ""A Tutorial on Teaching Data Analytics with Generative AI"" by Robert L. Bray.

In this insightful tutorial, the author explores innovative ways of integrating large language models (LLMs), like ChatGPT, into data analytics education. The paper introduces several novel techniques for teaching data analytics, reshaping traditional educational approaches. Here are some of the key insights from the study:

1. **AI Tutoring Sessions**: The paper suggests converting traditional homework assignments into AI tutoring sessions. Here, custom-made GPTs guide students through problem sets, enhancing engagement and learning. Students then submit their chatlogs as homework, transforming rote exercises into interactive learning experiences.

2. **Programming in English**: Another innovative method detailed is ""Programming in English"" (PIE), allowing students to express data transformations in natural language. The AI then translates these descriptions into code, resulting in students being more effective with programming languages like R compared to traditional tools such as Excel.

3. **Parallelized Instruction**: Using multiple custom GPTs simultaneously can facilitate unique teaching methods. Students can engage with different GPTs to master various parts of an analytics problem before teaching their peers, promoting collaborative learning.

4. **Enhanced Learning Outcomes**: The inclusion of AI has been shown to increase student interest and participation in analytics classes. One significant finding was the rapid increase in class enrollment, rising from 21 students to 162 over three years, attributed to the innovative use of AI in the curriculum.

5. **Adaptation and Experimentation**: The author reveals a refreshing perspective, treating AI integration as an educational experiment. This adaptability has led to the development of various in-class activities and tutoring techniques that utilize the strengths of LLMs to foster deeper understanding among students.

These strategies highlight the transformative potential of generative AI in education, offering a more engaging and effective learning experience. 

You can catch the full breakdown here: [Here](https://theministryofai.org/ai-meets-education-transforming-data-analytics-classes-with-generative-models/)
You can catch the full and original research paper here: [Original Paper](https://arxiv.org/abs/2411.07244)",removed,1
1gswklk,11,2024-11-16,A Tutorial on Teaching Data Analytics with Generative AI,u/steves1189,ChatGPTPromptGenius,https://www.reddit.com/r/ChatGPTPromptGenius/comments/1gswklk/a_tutorial_on_teaching_data_analytics_with/,"I'm finding and summarising interesting AI research papers every day so you don't have to trawl through them all. Today's paper is titled ""A Tutorial on Teaching Data Analytics with Generative AI"" by Robert L. Bray.

In this insightful tutorial, the author explores innovative ways of integrating large language models (LLMs), like ChatGPT, into data analytics education. The paper introduces several novel techniques for teaching data analytics, reshaping traditional educational approaches. Here are some of the key insights from the study:

1. **AI Tutoring Sessions**: The paper suggests converting traditional homework assignments into AI tutoring sessions. Here, custom-made GPTs guide students through problem sets, enhancing engagement and learning. Students then submit their chatlogs as homework, transforming rote exercises into interactive learning experiences.

2. **Programming in English**: Another innovative method detailed is ""Programming in English"" (PIE), allowing students to express data transformations in natural language. The AI then translates these descriptions into code, resulting in students being more effective with programming languages like R compared to traditional tools such as Excel.

3. **Parallelized Instruction**: Using multiple custom GPTs simultaneously can facilitate unique teaching methods. Students can engage with different GPTs to master various parts of an analytics problem before teaching their peers, promoting collaborative learning.

4. **Enhanced Learning Outcomes**: The inclusion of AI has been shown to increase student interest and participation in analytics classes. One significant finding was the rapid increase in class enrollment, rising from 21 students to 162 over three years, attributed to the innovative use of AI in the curriculum.

5. **Adaptation and Experimentation**: The author reveals a refreshing perspective, treating AI integration as an educational experiment. This adaptability has led to the development of various in-class activities and tutoring techniques that utilize the strengths of LLMs to foster deeper understanding among students.

These strategies highlight the transformative potential of generative AI in education, offering a more engaging and effective learning experience. 

You can catch the full breakdown here: [Here](https://theministryofai.org/ai-meets-education-transforming-data-analytics-classes-with-generative-models/)
You can catch the full and original research paper here: [Original Paper](https://arxiv.org/abs/2411.07244)",removed,14
1gtp9rg,1,2024-11-17,I built my own AI immigration lawyer to help me reach the American Dream,u/madjid513,SideProject,https://www.reddit.com/r/SideProject/comments/1gtp9rg/i_built_my_own_ai_immigration_lawyer_to_help_me/,"Hi everyone,

I’m a software engineer and a student in France, and I've been trying to build a side hustle for a while now. However, I was stuck for quite some time, not knowing exactly what idea to pursue.

Few days ago, I started asking myself, “What do I really want ?” and that’s when I realized, it’s my dream to move to the U.S. and live the American Dream.

I began using ChatGPT to get some guidance on the best ways to immigrate. But the answers I got weren’t as clear or structured as I needed them to be.

There was no way to easily input my personal, educational, and professional information to get a step-by-step guide. I wanted something that could tell me exactly what to do, like: “First, gather this document, then fill out this form, and so on.”

So, I decided to build something myself. I created a website called [Go2USA.xyz](http://Go2USA.xyz), where you can input all your personal, educational, and professional information, and in return, you get a PDF outlining the best visa path for you and exactly how to apply for it.

It’s designed to take the confusion out of the process and give you a clear, actionable plan for immigrating to the U.S. **What I also liked about it is that, unlike a lawyer, it doesn't forget and is familiar with all U.S. visa options. It can suggest lesser-known pathways to the U.S. that are easier and more affordable, ones that most people aren't aware of.**

And guess what, it got me the best plan, and I'm going to start following it to reach my American dream.

I decided to share it here to get some feedback, so don’t hesitate to share even the slightest idea on how to improve it.

PS : I’m new to this platform, so please excuse me if this isn’t exactly how I should be posting.

[Step-by-step guide to immigrate to the United States of America](https://reddit.com/link/1gtp9rg/video/z3zzinchdj1e1/player)

",User_deleted,0
1gtta20,447,2024-11-17,1/3 of my class plagiarized with google AI,u/nonfictionbookworm,GradSchool,https://www.reddit.com/r/GradSchool/comments/1gtta20/13_of_my_class_plagiarized_with_google_ai/,"I’m teaching a writing class and 1/3 of my class blatantly used the same word/phrase in a google search and all copied/pasted/removed one word so I wouldn’t think it was plagiarism. 

I also had several students give me sources that do not exist and were clearly generated by ChatGPT. 

Anyone else really struggling with this? Giving all zeros and next time it is to the student conduct board. They are all super early in their academic careers and I said MULTIPLE times to not use AI because I would find out🙃",active,821
1gu1hl9,18,2024-11-18,Predicted GPA accuracy advice,u/SiteMammoth5416,NTU,https://www.reddit.com/r/NTU/comments/1gu1hl9/predicted_gpa_accuracy_advice/,"https://preview.redd.it/344o240vum1e1.png?width=927&format=png&auto=webp&s=c8ff7fdf5868cc25ff1361f4092acd0d6822432d

Oh my god. How accurate do you guys think this is. For any context I had a whole rant posted previously and if anybody is wondering how I can do this bad this semester man I really don't know. I'm just struggling bad and TBF I haven't always been like this. Like back in poly I was genuinely scoring As and dean's list. I am going for counselling now and actively visit NBS student care so before anybody sh1ts on me, I am really trying. But in any case, I've thought through everything from the start of the semester to currently, like all the assignments I've submitted (most late) and e-learning exercises that I did not complete and quizzes I fail poorly. So I asked ChatGPT's opinion as seen from the image attached and I think I might actually receive academic warning or probation. This is crazy I never thought I would be in a position like this. But how accurate do you guys think this will be? I mean I would know myself best so I guarantee the grades I predicted I would get is accurate (if not worst). But I am not sure how the bell curve and etc. works. Plus, since most of the courses I am taking in Group B is considered the ""fluff"" course while Group A is the FA, FM, Phyton and etc. I want to gauge my situation right now. Any seniors or literally anybody could give me further insight on this?",User_deleted,20
