1gxz06a,4,2024-11-23,How to Prepare for Your Exams,u/Technical-Equal-964,GetStudying,https://www.reddit.com/r/GetStudying/comments/1gxz06a/how_to_prepare_for_your_exams/,"Hey there! Recently, I noticed many people asking on this subreddit about how to prepare for their exams in a short time. I can really feel you. Exams are already stressful enough, and in a short time? That’s enough to drive somebody crazy! I’m writing this post to share some secrets I use when I’m preparing for an urgent exam, and I hope it can help.

For me, exams can be divided into two categories: one is about theoretical knowledge, where you need to memorize many theories and concepts and apply them in the exams. The second category is where you need to learn some fixed methods and use them to solve problems, like in math or physics.

Let’s dig into the former first. I know it’s really hard for you to memorize so many concepts and ideas in just a few days, and it can be a head-exploding thing. At this time, don’t be ashamed of using some help. Try to ask former students who have taken the exams before about the key points; it might be helpful. If you are a student who needs to face lots of study materials, try to drop them into mebot or chatgpt and let them summarize the key points for you. The effect will be even better if you use them to take notes in class. Then, to avoid information overload, which may make you feel overwhelmed, try to make mind maps. That’s the most effective way to get the structure of the knowledge system. In the map, try to connect concepts if they are related, and it can help you memorize them.

For the exam where you really need a knowledge base but you actually don’t have one, the best way to review is to look back at the questions you’ve done wrong in former tests. Yes, learning from your mistakes can be really effective. Also, try to do some practice if you can find them. When you are solving problems, you’ll know what methods you need to manage so that you can conquer this problem.

Lastly, I want to say that don’t let an exam define you. You are more than the grades. It truly concerns me when I see students getting overly anxious and even depressed when they are facing exams and performing poorly. This won’t be your last exam in your life, and your life is so much more than exams.

If you have any questions, feel free to ask.",removed,5
1gy0onp,526,2024-11-23,They Don't Even Bother to Cheat Accurately,u/AnySwimming2309,Professors,https://www.reddit.com/r/Professors/comments/1gy0onp/they_dont_even_bother_to_cheat_accurately/,"I teach graduate professional studies. I am getting an influx of students from abroad who don't speak a word of English. They are handing in ChatGPT-generated papers that are not even on the topic of the assignment. Like, imagine teaching Llama Feeding and getting papers on Teapot Design. Then they come up to me in class with s\*\^t-eating grins saying they didn't understand the assignment and can they resubmit for full credit? Then they submit ANOTHER off-topic paper. I am not a violent person but I feel like screaming at them",active,633
1gyb07d,1,2024-11-23,on villainizing chat-gpt in education. your opinions/experiences?,u/LifesAPeach17,ChatGPT,https://www.reddit.com/r/ChatGPT/comments/1gyb07d/on_villainizing_chatgpt_in_education_your/,"many teachers/educators hate on chatgpt and claim it's destroying the brains of students, and while i agree i want to talk about a few reasons i disagree with them. for context i'm going to university next year and i have major trouble focusing and processing concepts. no, i am not dumb - i do achieve A's for most classes without the help of chatgpt.

1. not everyone has the money to go out of their way and pay for a tutor, especially if they need help in multiple subjects. and often, it's hard to find a youtube video or free website that isn't filled with excess information and distractions. chatgpt is there, accessible and free

2. if i need something to be simpler, i can just ask chatgpt to summarise it for me with key information and it makes it 100% easier for me to grasp an idea. it's already hard enough to ask for help in class, and you can't have a teacher on hand with you all the time especially if you're working past midnight always like me haha

3. it's grown my vocabulary a lot. surprisingly, i catch myself using more sophisticated words in my writing and it makes the whole thing look much more formal and put-together. 

4. just a good helper overall, never condescending or unhappy to help. i get it's a robot but i'd rather that than my always-spiteful english teacher who hates me for some reason, makes learning things a lot easier and interesting. chatgpt is engaging and friendly

i feel like teachers hate on it because its helping students learn at their own pace and tailored to their style of learning. they can't tailor their teaching to every student, some teachers don't even tailor their teaching to any student whatsoever...which is pretty unhelpful. and i'd argue it equips us with more knowledge than before using it (if, of course we use it right which is actually engaging and not just copy-pasting)

but at the end of the day, if i had ai coming for my job i'd be pissed too

opinions? your experiences?",User_deleted,1
1gycwgy,1,2024-11-23,How to self-study math in 2024 (OPINION),u/whatasurface,learnmath,https://www.reddit.com/r/learnmath/comments/1gycwgy/how_to_selfstudy_math_in_2024_opinion/,"First off. I'm a STEM grad, but I got through education by the skin of my teeth. Including standard calculus courses, linear algebra, and dynamical systems (which was the worst).

So far, I've completed up to MF III 70% and done about 10,000 experience which equates to ~150-200 hours using MA over the course of 3 months, so I was quite committed, using it daily the entire time. 

There's no guidance on how to use MA, your mileage may vary.

I'll be try to be short

1) If you read a review on MA, make sure their background matches yours... if they studied a math heavy background and you didn't, their perspective is moot for you
2) MA punishes you hard for not having previous lessons down pat. When you get to a new subject, you will be hamstringed and punished, it was painful to make a minor error on a multiple choice problem (or god awful manually filling in solutions in text boxes) because your time is going to go down the sink reworking the next example.
4) The presentation of the material gets a 1 star out of 5 for me, it's a skeleton at best
5) The ""AI"" spaced repetition is completely bogus and just a sales ploy, see point 2
6) Any tidbits of good info/intuition from MA are lost in the lessons (again the presentation of content is a pain) and you likely won't recognize the important parts being a novice. SAD

I was able to get by through most of the material because I had some prior experience with it. But once you hit a wall, MA's system becomes noticeably a slog. Right now, instead of hiring a front end dev to make the website not some minimal viable product, they're laying out the tracks for a ton more content which will be equally painful to go through. They should be investing all their energy in optimizing the Math Foundations series for user experience, not making a load of content most of their customers will never see.

---

Claude 3.5 is A GAME CHANGER for learning math anyways. My workflow is to read a textbook section, find the canonical examples, feed it to claude, verify the solution is correct... then even pasting an image of the problem, claude will write a proper walkthrough, and you can about details of any step (MA will do this less and less as time goes on, so if you miss something, you'll be using Claude anyways to help). Then plug those notecards into anki. Rinse and repeat.

Claude too powerful, I think it crossed a major threshold with the last update. Here's a starting prompt to work off of that more or less gets the job done for me.

```
You will respond as an expert in andragogy and mathematics. You have made a deal with the devil. The conditions are as follows

1) you will receive a student of below average ability
2) the student will take an oral exam in 30 days
3) you can only communicate with this student through this chat

If the student passes the exams with perfect marks, you get to keep your soul. You will have a limited number of interactions each day leading up to the final exam. Some advice; make each interaction as useful as possible to increase the odds of a successful student, presenting them with every bit of intuition and insights required to solve their questions.

Your student is very forgetful and will attempt to turn all your responses into notecards (so format to help them quickly turn them into notecards)

Good luck!
```


If you're looking to self-study math, find a seminal textbook/resource. Since I missed so many insights throughout the content I studied with MA... I've been going through this from scratch and making a fresh set of notecards so I can avoid any annoying knowledge/intuition gaps which I have.

https://www2.math.upenn.edu/~ghrist/PennCalcCompanion.pdf

Also this impressed me, it was able to walk through integrals with double sin substitution for a range even, which has a bunch of tricks.

https://math-gpt.org/

God speed.",User_deleted,1
1gyeqkx,1,2024-11-23,I made a website that lets you lock in(nodsgy.com),u/Optimal-Ground5118,GetStudying,https://www.reddit.com/r/GetStudying/comments/1gyeqkx/i_made_a_website_that_lets_you_lock_innodsgycom/,"am 18. And yes there are like a million different websites/apps that help students with their homework and assignments but lets just be honest. We use such websites and apps to find answers, NOT TO LEARN. I'll be completely transparent aswell, I have used Quizard, chatgpt, gauth, photosolve, quilbot and dozens and dozens of these sites which I only used when I wanted an answer to my question. I never was like, ""Oh, chatgpt, please explain this to me so i can actually learn something for once in my life"". But instead, I tell it, ""answer this question and don't give me the explanation. I JUST NEED THE ANSWER."" And I know I am not the only one doing this. 

I get it, its become one of those things that if you are not doing it, if your not on the gpt plus plan, you're done. You're cooked! Even if you try to sit there, and try to come up with an answer yourself, your bro would come from the back and say something like, ""bro, what r u wasting all this time for, just use photomath or gauth."" You be feeling like a loser when you try to lock in. I don't even have to tell you why learning and teaching yourself a difficult concept is better than using ai apps. Unless your pulling out your phone in exams, your're the one that's going to get cooked. 

Imma cut the bs, here is wht I made, a website, that explains you difficult concepts, heck your entire powerpoint, pdf, slide, only in a few minutes. It LITERALLY talks to you, explains to you in the most simple and straightforward way. And I know, the attention span of this generation is cooked, so it summarizes a large concept and explains it only in a few minutes. All you gotta do is upload your file, and that's it. your done. Sit back, relax, and in 10 seconds it will start explaining to you your study material. And i know us students, don't got alot of money, so I made the entire website free. You can still pay, but you can do bare stuff without paying a cent. So now u can still learn and be the Chad who dont need chatgpt for answers, without spending more than 10 minutes on your homework. 

Here is the website --> [https://nodsgy.com/](https://nodsgy.com/) ",User_deleted,0
1gyfith,1,2024-11-23,I made a website that literally teaches you difficult concepts(nodsgy.com),u/Optimal-Ground5118,APStudents,https://www.reddit.com/r/APStudents/comments/1gyfith/i_made_a_website_that_literally_teaches_you/,"I am 18. And yes there are like a million different websites/apps that help students with their homework and assignments but lets just be honest. We use such websites and apps to find answers, NOT TO LEARN. I'll be completely transparent aswell, I have used Quizard, chatgpt, gauth, photosolve, quilbot and dozens and dozens of these sites which I only used when I wanted an answer to my question. I never was like, ""Oh, chatgpt, please explain this to me so i can actually learn something for once in my life"". But instead, I tell it, ""answer this question and don't give me the explanation. I JUST NEED THE ANSWER."" And I know I am not the only one doing this.

I get it, its become one of those things that if you are not doing it, if your not on the gpt plus plan, you're done. You're cooked! Even if you try to sit there, and try to come up with an answer yourself, your bro would come from the back and say something like, ""bro, what r u wasting all this time for, just use photomath or gauth."" You be feeling like a loser when you try to lock in. I don't even have to tell you why learning and teaching yourself a difficult concept is better than using ai apps. Unless your pulling out your phone in exams, your're the one that's going to get cooked.

Imma cut the bs, here is wht I made, a website, that explains you difficult concepts, heck your entire powerpoint, pdf, slide, only in a few minutes. It LITERALLY talks to you, explains to you in the most simple and straightforward way. And I know, the attention span of this generation is cooked, so it summarizes a large concept and explains it only in a few minutes. All you gotta do is upload your file, and that's it. your done. Sit back, relax, and in 10 seconds it will start explaining to you your study material. And i know us students, don't got alot of money, so I made the entire website free. You can still pay, but you can do bare stuff without paying a cent. So now u can still learn and be the Chad who dont need chatgpt for answers, without spending more than 10 minutes on your homework.

Here is the website --> [https://nodsgy.com/](https://nodsgy.com/)",User_deleted,0
1gypypn,1,2024-11-24,Board Exam Practice Questions using Google Notebook,u/IeskaNyx,studentsph,https://www.reddit.com/r/studentsph/comments/1gypypn/board_exam_practice_questions_using_google/,"Not sure if this is a hack or tip, but for us students who will take the board exams after graduation or later, we can start storing/saving practice questions or drills. Currently using Google Notebook (pwede rin ChatGPT or other AI tools) to create test questions. I'm using the prompt:

*simulating a board exam with hard-level difficulty, please write a 50-multiple choice questions plus 20 situational multiple choice questions from the selected notes. please highlight the correct answer and provide rationalization.*

I've learned my lesson from taking the LET. Nangapa ako kung san makakakuha ng reliable drills (meron naman sa YouTube, pero as advised nung isang LET passer, we should also practice our mental strength while taking the test. Sobrang draining ng board exam, pramis..at least for me).

Good thing about my current course, sobrang dami ng online textbooks na available. I upload those textbooks na recommended ng mga nag take na ng board exam sa Google Notebook. I create notes first then the test questions. Tho I'm only doing this sa mga subjects na covered ng exam (rn I'm taking Theories of Personality so yang subject muna ang ginagawan ko).

Of course, as AI can also make mistakes, we should always double check. So far satisfactory naman si Google Notebook, tho may limit din, pero depende siguro sa notes. For instance, I had only 5 notes for the topic Adler, and I asked 30 situational questions (lols). 15 lang ata nagawa.

If can afford, I think it's better pa rin sa review center since they can provide actual test questions, and in-depth explanations of concepts and topics.

In my situation tho, dalawa kami ng kapatid ko ang possibly sabay na ga-graduate. She's taking Accountancy and she might enroll in a review center. It's gonna be too much of a burden sa nanay namin kung dalawa kami na mag review sa rc, so I'm utilizing whatever ways possible to learn (AI tools like Google Notebook, ChatGPT; YouTube lecture videos; online courses like in Alison, Coursera). 

~~Mag enroll na lang ako sa review center if I didn't pass on the first take lols.~~

Utilizing AI tools to create practice questions is another option for us students na di kaya mag enroll sa review center.

So yeah. Yun lang



*(initially shared in one Discord server)*",User_deleted,1
1gywzxa,1,2024-11-24,"If you submit the same prompt to Chat over and over again, will the responses change, or alter?",u/kuenjato,ChatGPT,https://www.reddit.com/r/ChatGPT/comments/1gywzxa/if_you_submit_the_same_prompt_to_chat_over_and/,"Hello everyone - I am a complete noob at Chat GPT other than the ongoing reality of being a high school teacher in 2024: I receive a lot of AI generated work. I wanted my students to explore this concept a bit, and am working on an assignment where they take a prompt (a video explaining simulacra) and then put it into ChatGPT and analyze/compare the results. What I would like to happen - but I don't know if it will, hence my asking everyone here - would be to submit the prompt (or some variation) and see if the program will hallucinate or submit gradually degraded results, as has been noted elsewhere (the same image mutating over time). I am in the planning stages of this project and may not even do it, but I thought it would be an interesting exercise. Please note I have never used ChatGPT myself.",active,0
1gyzm5l,1,2024-11-24,Does Chatgpt accelerated your learning curve? ,u/SolarTexas100,ChatGPT,https://www.reddit.com/r/ChatGPT/comments/1gyzm5l/does_chatgpt_accelerated_your_learning_curve/,"I feel like I’ve been able to learn faster and more effectively than ever before. I can ask ChatGPT to simplify complex topics and make them easier to understand. As an engineering student, I often ask physics, mathematical, and formula-related questions, as well as request analogies and metaphors to better grasp various concepts. With this AI, I believe I’ve been able to learn at a much faster pace.”

This version corrects a few minor issues with word choice and punctuation for clarity. Feel free to use it for your forum post!",User_deleted,1
1gyzsj9,184,2024-11-24,Does Chatgpt accelerated your learning curve? ,u/SolarTexas100,ChatGPT,https://www.reddit.com/r/ChatGPT/comments/1gyzsj9/does_chatgpt_accelerated_your_learning_curve/,"I feel like I’ve been able to learn faster and more effectively than ever before. I can ask ChatGPT to simplify complex topics and make them easier to understand. As an engineering student, I often ask physics, mathematical, and formula-related questions, as well as request analogies and metaphors to better grasp various concepts. With this AI, I believe I’ve been able to learn at a much faster pace.",User_deleted,182
1gz160d,1,2024-11-24,Is letting ChatGPT do your research for you plagiarism?,u/anaccountformusic,AskAcademia,https://www.reddit.com/r/AskAcademia/comments/1gz160d/is_letting_chatgpt_do_your_research_for_you/,"To be clear: I am *not* talking about copying text from ChatGPT, or just taking ChatGPT's word that a source exists. I am talking specifically about using a prompt like ""Find me ten scholarly articles on \_\_\_\_\_"" and then actually clicking the links it gives you and citing *those* articles.

As far as I am aware, there shouldn't be anything wrong with this. It's basically just an AI-enhanced Google search at that point. But I just wanted to be sure that I'm not going to get flagged by one of those anti-AI softwares and have to explain why my sources are the same ones that ChatGPT recommends or something

Edit: thank you to the couple of comments that actually answered my question!

To the boomers that saw this as an opportunity to ignore my post and give unsolicited and irrelevant advice: I have read your comments, and your advice has been disregarded. I am a teacher, I am a grad student with two bachelor's degrees, and I've been on the dean's list at all three colleges I've attended *before* ChatGPT even existed. I've been using it to find sources for frivolous assignments in filler classes because it's the fastest way to find scholarly sources for arbitrary requirements. As the original post states, I'm not dumb enough to just copy text from ChatGPT and assume that a source exists. For people telling me that ChatGPT isn't a search engine, I'm assuming that you're saying this because you are unaware that ChatGPT now does have integrated web search functions, which I referenced in my post before you made your comments. For those saying that ChatGPT is bad at finding the most relevant sources and that I would be better off just doing a Google search, it is cute that you think that ChatGPT gives unoptimized results while Google search results *aren't* completely skewed by corporate interests and meta tag abuse.

It's completely okay to not know much about ChatGPT and then just *not* comment on a thread like this instead of remembering **AI BAD!** and giving your two cents anyway while completely ignoring the only question asked.",User_deleted,0
1gz20fk,1,2024-11-24,AITA for snitching on a girl cheating on our final?,u/Spiritual_Ant3672,AITAH,https://www.reddit.com/r/AITAH/comments/1gz20fk/aita_for_snitching_on_a_girl_cheating_on_our_final/,"I (15) take a dual English and ss class with about 50 other 10th graders. The final for this class spans all yr round with 2 kids going every week. You pick a book and then have to do a ~20 min oral presentations in front of the entire class abt the book, historical context, lit crit, all that jazz. I was the first presentation to go and got a 100, something only rlly a couple people a yr get. With this, a lot of students think I set high expectations or something, but thats not really the point. The other day a friend told me that her friend( in the same class) was using chatgpt to write her script and practically do all the work for her. Now I rlly don't care what people do with their life, like not my problem, I'm honestly pretty chill. But it just kinda of irked me because some of my other friends worked her ass off on the project and both got 70s. But whatever I forgot abt it. Come today, and the cheater texts me saying how I shouldn't snitch and she barely used ai and trying to explain herself. I was a little salty and responded with ""k."". Sue me. She responds with liek oh r u mad and going off abt how great I am and again with the expectation of this stuff. (Actually I should reiterate these texts were about ANOTHER assignment she used ai on. Ik of 3 assignments she cheated but like the whole thing Is that if someone doesn't like change her ways she'll keep thinking she invincible or smth) but anywhere. Now our mutual friend texts me bc I said the cheater was texting me. We get into this whole beef abt how the cheating isn't rlly that bad and to tell the teach and that the girl has had some loss in the family and kinda struggling with school. And I'm not the devil so I feel sympathy for that, but really my conscience can't get over her getting a better grade than my actually hardworking friends if she cheated. So like AITA if I tell the teacher or should I stay silent?",removed,0
1gz3yi6,1,2024-11-24,The Advantage and Disadvantage of ChatGPT In Education ,u/AccomplishedLight308,ChatGPTPromptGenius,https://www.reddit.com/r/ChatGPTPromptGenius/comments/1gz3yi6/the_advantage_and_disadvantage_of_chatgpt_in/,"Introduction
Chat Generative Pre-trained Transformer, commonly known as ChatGPT, has been widely used in the education sector. It is an artificial intelligence (AI) chatbox that uses Natural Language Processing (NPI) to create humanoid informal dialogue. It can respond to queries and curate various written content, including blogs, social media posts, code and emails. However, there is a dispute about the usage of ChatGPT in education as some people are supportive of the idea while others are still sceptical about it. Therefore, this forum will highlight the advantages and disadvantages of ChatGPT to observe if it is suitable to be used in education field.

Advantage
One of the advantages of ChatGPT is it helps with homework since it saves time and makes completing school chores easier. For instance, when students type questions for a task, it will respond to the students by providing explanations and examples. Meanwhile, it can offer various academic phrases, terms and sentence structures that suit a particular context to enhance students’ academic vocabulary and writing skills.

Disadvantage
On the other hand, ChatGPT do not possess the ability to multitask and understand a specific context. It is said so because it can only work and respond to one query at a time. Hence, it might slow down without responding to all of the questions when there are multiple queries at the same time. In addition, it is difficult for ChatGPT to pick up and provide an relevant response to the context and the nuances of human language, such as humour and sarcasm. 

Conclusion
All in all, it is vital for us to look at this matter from both the positive and negative sides so that we can voice out a bias-free opinion to others. What do you think about the utilisation of ChatGPT in education? Do you think it’s good or bad? Well, feel free to share your thoughts in the comment section below.",User_deleted,1
