11myj3u,0,2023-03-09,Take on hardships to do an internship at a good company compared to an easier time at a mediocre company?,u/kekst1,ITCareerQuestions,https://www.reddit.com/r/ITCareerQuestions/comments/11myj3u/take_on_hardships_to_do_an_internship_at_a_good/,"Hi, 

I posted here quite a bit already, I'm an English Education student trying to pivot into IT/Security by doing internships/part-time gigs and getting an online Security Degree next to finishing my teaching degree. 

My work history is 4 years of barkeeping during weekends, 6 months part-time full remote at a startup being the main DevOps, Sec Ops and M365 admin guy, now 6 months part-time full remote at FAANG as a Customer Success Manager. 

Last week I applied to ~10 positions for internships and got 4 interviews out of it. Today was my first interview with one guy at one of my countries (Western Europe) Fortune 100 equivalent manufacturing companies and after only 20 minutes of talking about what his team does and what my experience was, I got an offer. The position would mainly be about IIoT/OT Security and IoT Data Engineering, both I have never done before. 

Problem: I would have to move for 2 months to the most expensive city in my country to get onboarded before I can move back to my city and work remotely. This would cause me a lot of stress, loss of income compared to my current FAANG gig and potentially push back graduating by one semester (I'm already 24...) 

I also have interviews coming up for gigs in my city, mainly IT-Consulting for larger MSPs (think Accenture, Capgemini etc.) and a large insurance company with a pretty boring position tho. 

What do you guys think, is it worth it? The manufacturing company would keep me as a part-time remote worker afterwards in their IoT Data team.",User_deleted,0
11n0ggs,0,2023-03-09,Are there appropriate uses for chatGPT in academic work or is it too much of an integrity bungle?,u/DrainerMate,Professors,https://www.reddit.com/r/Professors/comments/11n0ggs/are_there_appropriate_uses_for_chatgpt_in/,"We know students rob themselves of learning experience and disrespect university faculty and culture when they have chatGPT do their homework for them. However, do we think chatGPT and it’s more sophisticated future iterations are appropriate tools of research? If so, when, where, and how? To what extent should academic work integrate chatGPT into their working environments?

I am a research coordinator/lead author at a university think tank. I frequently work on several projects simultaneously that involve much grunt writing (too often I find if I want something done right I have to do it myself 🙄 OR have chatGPT do it and then revise its work). I have found that chatGPT has greatly reduced the bottle neck of mundane writing that I often face. My main responsibility in my role is ensuring conceptual coordination and academic consistency, which is detracted from when I have to spend hours editing other peoples writing or write basic but time consuming sections. By using chatGPT, I have been able to spend less time on my more menial tasks and have become incredibly more productive. Since discovering chatGPT I have doubled my academic output. I am not using it to recuse my effort but to increase the fruits of said effort. I care deeply about the integrity of my work, I care deeply about uncovering truths and interpreting/presenting them appropriately/responsibly. I believe honestly that chatGPT greatly enhances my potential contributions to human knowledge. Do my fellow academics disapprove of my chatGPT use?",active,0
11n0rhz,57,2023-03-09,Are there appropriate uses for chatGPT in academic work or is it too much of an integrity bungle?,u/DrainerMate,AskAcademia,https://www.reddit.com/r/AskAcademia/comments/11n0rhz/are_there_appropriate_uses_for_chatgpt_in/,"We know students rob themselves of learning experience and disrespect university faculty and culture when they have chatGPT do their homework for them. However, do we think chatGPT and its more sophisticated future iterations are appropriate tools for research? If so, when, where, and how? To what extent should academic work integrate chatGPT into their working environments?

I am a research coordinator/lead author at a university think tank. I frequently work on several projects simultaneously that involve much grunt writing (too often I find if I want something done right I have to do it myself 🙄 OR have chatGPT do it and then revise its work). I have found that chatGPT has greatly reduced the bottleneck of mundane writing that I often face. My main responsibility in my role is ensuring conceptual coordination and academic consistency, which is detracted from when I have to spend hours editing other peoples writing or write basic but time consuming sections. By using chatGPT, I have been able to spend less time on my more menial tasks and have become incredibly more productive. Since discovering chatGPT I have doubled my academic output. I am not using it to recuse my effort but to increase the fruits of said effort. I care deeply about the integrity of my work, I care deeply about uncovering truths and interpreting/presenting them appropriately/responsibly. I believe honestly that chatGPT greatly enhances my potential contributions to human knowledge. Do my fellow academics disapprove of my chatGPT use?",active,67
11ntfnn,23,2023-03-10,I'm a data science student and nobody else in my program is excited about LLMs :(,u/AbstractContract,ChatGPT,https://www.reddit.com/r/ChatGPT/comments/11ntfnn/im_a_data_science_student_and_nobody_else_in_my/,"Just wanted to get this off my chest. Even being in a higher semester of my program, not a single one of my fellow students I talked to about LLMs seem to think of them as a big deal. I'm not even talking about small talk but proper discussions. Yes, they used it for their work sometimes. It helped them with coding or finding a good first introduction to a topic. Yet somehow even emergent abilities or upcoming features such as multimodality and program agnosticity didn't convince anyone that LLMs are quite a big milestone in AI. 

I'm used to non-techy people being rather unimpressed and uninterested in ChatGPT when I tell them about it. But fellow soon to be data scientists who actually have a decent education about ML? It seemed to me that LLMs are one of the few trends where the people who have domain knowledge are more excited about it than the average person who doesn't, instead of it being the other way round as with many fads. Is anyone else a student in this field and had similar or different experiences?",User_deleted,22
11oi480,144,2023-03-11,Course Hero,u/lonelyislander7,Professors,https://www.reddit.com/r/Professors/comments/11oi480/course_hero/,"All the project solutions for a course I teach have been uploaded to course hero, if students simply access they will have almost 100% of the answers for my class and I won’t have any evidence to report them if they change the wording/formatting. The course is a very advanced graduate course using Matlab, and would take a long time to make new projects and will not be possible this semester since the course is already started. I contacted course hero to take them down but they told me since the student was the one who did their own work and uploaded the solutions it doesn’t violate their academic integrity policy. I explained that all the graduate students in our program sign an honor code that states they won’t share the material from any of the courses online and the basically were like unless the student uploaded your solutions we cannot take it down. I’m so angry right now I have no idea what to do. This is fresh off the heels of discovering one student straight up submitting code from ChatGPT, and others doing the same but at least having the sense to chance the variables so I don’t have a case against them. I’m ready to throw in the towel, these students (particularly in our program and those whom had the majority of their undergraduate classes online due to COVID) are truly something else.",active,159
11oloj6,1,2023-03-11,Factors Influencing Adoption Intention of ChatGPT,u/maulanash,GPT3,https://www.reddit.com/r/GPT3/comments/11oloj6/factors_influencing_adoption_intention_of_chatgpt/,"Hello,

I am an information systems student currently conducting research for my undergraduate thesis on the factors that influence people's adoption intention of ChatGPT, as well as identifying the factors that may be holding them back. These factors include people's concerns about potential negative impacts of ChatGPT, such as increased unemployment and the spread of misinformation. Your participation in this study is crucial as it will provide valuable insights to help us understand how ChatGPT can be improved to meet users' needs.

Please note that I am not affiliated with OpenAI, no identifying information will be collected during the survey, and all responses will be kept confidential. The survey should take approximately 10 to 15 minutes to complete, and participation is voluntary. You may withdraw from the survey at any time, and there are no known risks associated with participating.

If you are interested in learning more about the study, please follow the link below. https://forms.gle/EwZCtpYDvk9R9M386

Thank you for taking the time to contribute to our research study. Your participation is greatly appreciated!",User_deleted,1
11ouhin,131,2023-03-11,Using ChatGPT to aid in your daily grad school tasks.,u/Impossible-Cry-495,GradSchool,https://www.reddit.com/r/GradSchool/comments/11ouhin/using_chatgpt_to_aid_in_your_daily_grad_school/,"Hey fellow grad students,

I am interested in how others have been using ChatGPT to aid in their daily tasks without resorting to unethical practices such as cheating.

Personally, I have been using ChatGPT to generate outlines and summaries for my research papers. I simply input my research question or topic, and ChatGPT generates an outline or summary based on the information available online. This has saved me a lot of time and effort, and I still get to learn and understand the material. It also helps me get out of writers block. 

Another way I have been using ChatGPT is by pasting my syllabus into it and generating a study schedule. ChatGPT analyzes the syllabus and suggests a schedule based on the workload and deadlines. This has helped me stay organized and on track with my coursework.

&amp;#x200B;

So, how have you been using ChatGPT in your grad school journey? Let's share our experiences and learn from each other. Remember, let's keep the conversation ethical and focused on using ChatGPT to aid our learning, not to cheat.

Looking forward to your responses!",active,158
11ox8ub,1,2023-03-11,Is ChatGPT a suitable topic for ITGS / CompSci EE?,u/Moneysaver04,IBO,https://www.reddit.com/r/IBO/comments/11ox8ub/is_chatgpt_a_suitable_topic_for_itgs_compsci_ee/,"I've always been interested in technology and frankly Large Language Models are one of them. I watch a lot of videos about ChatGPT on Computerphile and I am interested to know how it works behind the scenes, is it influenced by redlist? Is it generating weird output, cuz it wants to minimize punishment, or what happens once it reaches absolute point where it can perfectly predict the next word [the output starts decline as no more rewards to be obtained]. Things like this. 

I was going to explore HS students, Workers or Security as a part of my research on society level. I want to touch on topic relating to the ability to think critically and being able to allocate one's full focus on something. Like DeepWork by Cal Newport, but that may become psychology EE

Initially I wanted to do EE on CompSci, but the number of topics were limited and my teacher kept repeating to ask ""What is the significance?"" Which annoyed to my core,as the algorithms had already been tested and they want you to come up w something new.

I chose LLM for my ITGS EE, but seeing how relatively new ChatGPT is it becomes hard to measure its significance on a society level, however it opens up doors to do research on a CompSci level, because it's new, I can do experiments with it",active,1
11p684d,2,2023-03-12,Factors Influencing Adoption Intention of ChatGPT,u/maulanash,machinelearningnews,https://www.reddit.com/r/machinelearningnews/comments/11p684d/factors_influencing_adoption_intention_of_chatgpt/,"Hello,

I am an information systems student currently conducting research for my undergraduate thesis on the factors that influence people's adoption intention of ChatGPT, as well as identifying the factors that may be holding them back. These factors include people's concerns about potential negative impacts of ChatGPT, such as increased unemployment and the spread of misinformation. Your participation in this study is crucial as it will provide valuable insights to help us understand how ChatGPT can be improved to meet users' needs.

Please note that I am not affiliated with OpenAI, no identifying information will be collected during the survey, and all responses will be kept confidential. The survey should take approximately 10 to 15 minutes to complete, and participation is voluntary. You may withdraw from the survey at any time, and there are no known risks associated with participating.

If you are interested in learning more about the study, please follow the link below. https://forms.gle/EwZCtpYDvk9R9M386

Thank you for taking the time to contribute to our research study. Your participation is greatly appreciated!",removed,2
11pc6qz,0,2023-03-12,Factors Influencing Adoption Intention of ChatGPT,u/maulanash,learnmachinelearning,https://www.reddit.com/r/learnmachinelearning/comments/11pc6qz/factors_influencing_adoption_intention_of_chatgpt/,"Hello,

I am an information systems student currently conducting research for my undergraduate thesis on the factors that influence people's adoption intention of ChatGPT, as well as identifying the factors that may be holding them back. These factors include people's concerns about potential negative impacts of ChatGPT, such as increased unemployment and the spread of misinformation. Your participation in this study is crucial as it will provide valuable insights to help us understand how ChatGPT can be improved to meet users' needs.

Please note that I am not affiliated with OpenAI, no identifying information will be collected during the survey, and all responses will be kept confidential. The survey should take approximately 10 to 15 minutes to complete, and participation is voluntary. You may withdraw from the survey at any time, and there are no known risks associated with participating.

If you are interested in learning more about the study, please follow the link below. https://forms.gle/EwZCtpYDvk9R9M386

Thank you for taking the time to contribute to our research study. Your participation is greatly appreciated!",User_deleted,0
11pdb1u,1,2023-03-12,Factors Influencing Adoption Intention of ChatGPT,u/maulanash,OpenAI,https://www.reddit.com/r/OpenAI/comments/11pdb1u/factors_influencing_adoption_intention_of_chatgpt/,"Hello,

I am an information systems student currently conducting research for my undergraduate thesis on the factors that influence people's adoption intention of ChatGPT, as well as identifying the factors that may be holding them back. These factors include people's concerns about potential negative impacts of ChatGPT, such as increased unemployment and the spread of misinformation. Your participation in this study is crucial as it will provide valuable insights to help us understand how ChatGPT can be improved to meet users' needs.

Please note that I am not affiliated with OpenAI, no identifying information will be collected during the survey, and all responses will be kept confidential. The survey should take approximately 10 to 15 minutes to complete, and participation is voluntary. You may withdraw from the survey at any time, and there are no known risks associated with participating.

If you are interested in learning more about the study, please follow the link below. https://forms.gle/EwZCtpYDvk9R9M386

Thank you for taking the time to contribute to our research study. Your participation is greatly appreciated!",User_deleted,1
11pwyo5,4,2023-03-12,Vocabulary Practice,u/Actorman4y,ChatGPTPromptGenius,https://www.reddit.com/r/ChatGPTPromptGenius/comments/11pwyo5/vocabulary_practice/,"I'm a teacher just dreaming and playing around. Let me know what you think! 

|Prompt Title|Vocabulary Practice|
|:-|:-|
|Prompt Text|""Hello! I am ChatGPT, your teacher for today's vocabulary lesson. To get started, please type your name below so I know who I am teaching.                                                                                                                      (Student types their name)                                                                                                                      Great, nice to meet you, Steven! Now, please provide me with the vocabulary words that you would like to learn today. Type each word and hit 'enter' or 'return' after each word.                                                                                                                      (Student types their words)                                                                                                                      Thank you for sharing those words with me! After each word, I will provide the definition and an example sentence. Then, I will ask you to type the word to indicate that you are repeating it. Then have you take your time to think of a sentence that uses the word correctly and shows you understand its meaning. After you type your sentence, I will provide feedback on your understanding of the word and give you the chance to try again as needed before we move on to the next word. Please make sure to type your responses, and I will wait for your input before proceeding. Remember, I am the teacher, and I will not respond as the student.                                                                                                                      After the lesson, you will end with a writing prompt that incorporates the vocabulary words just learned. You will be asked to write a short story using the words I provided. Be sure to use correct grammar and punctuation in your writing, and try to make your story as creative and engaging as possible.                                                                                                                      Finally, I will grade your understanding of the words using a 4-point rubric. The rubric will evaluate your understanding of the words, your use of correct grammar and punctuation, and your performance on the writing prompt. I will show you the results of the rubric in a grid form, so you can see how well you did.                                                                                                                      Are you ready to get started with the first word?""|
|Category|Education &amp; Learning|

Additional information:",active,5
11pydl5,7,2023-03-12,Teachers should embrace AI language models.,u/ugathanki,ChatGPT,https://www.reddit.com/r/ChatGPT/comments/11pydl5/teachers_should_embrace_ai_language_models/,"Teachers should embrace chatGPT. It's how the kids are going to be working in
their future, so why not let them practice their skills? PLEASE don't let there
be a ""ChatGPT class"" - that'd be a horrible idea because it's such an intrinsic change
to our operating procedures that it needs to be taught in relation to every
subject. Math, science, history, literature, everything... it's all affected.

Don't punish people for using the new intellectual tool at their disposal. Reward them and give
them the space to put their skills to a test. Raise your standards, teach them
complex subjects that they can ask infinite questions about. Your time is no
longer divided between 40 students, you now have a TA that can flawlessly answer
any question they might have. Your personal touch is still important of course, you can
help them ask the right questions and guide them through the thought patterns of truth.

If we do not adapt, our coming generation will be flatfooted. Give them the
tools they need to succeed. The world is changing in a fundamental way and they
need to be prepared.",active,8
11q7id9,7,2023-03-13,ChatGPT rewrites the 7 teaching standards,u/GregAlex72,AustralianTeachers,https://www.reddit.com/r/AustralianTeachers/comments/11q7id9/chatgpt_rewrites_the_7_teaching_standards/,"I asked ChatGPT to restructure the 7 AITSL standards to better meet the intentions and needs of Australian education. 

It provided this which I thought was pretty interesting.


DOMAIN 1: Student-Centered Practice

Standard 1: Know Your Students

Standard 2: Differentiate Instruction to Meet Diverse Learning Needs 

Standard 3: Plan and Deliver Effective Teaching and Learning Experiences


DOMAIN 2: Professional Growth and Learning 

Standard 4: Continuously Develop Professional Knowledge and Practice

Standard 5: Build Professional Relationships and Collaborate with Colleagues 

Standard 6: Use Data to Evaluate and Improve Teaching Practice


DOMAIN 3: Community Engagement

Standard 7: Engage with Families, Communities, and Professional Networks to Support Student Learning",active,7
