11fi7ue,2,2023-03-01,"[My Research] ChatGPT: Challenges, Opportunities, and Implications for Teacher Education",u/Jeromiewhalen,ArtificialInteligence,https://www.reddit.com/r/ArtificialInteligence/comments/11fi7ue/my_research_chatgpt_challenges_opportunities_and/,"Abstract: Interest in Artificial Intelligence (AI) has increased dramatically since the launch of ChatGPT in November 2022. While ChatGPT has captured the imagination of students and educators alike, several concerns have also emerged. In this editorial, we first discuss challenges and opportunities associated with the use of AI in K-16 Education broadly. We argue that the best way to address challenges and inappropriate uses of AI is by focusing on inclusion rather than exclusion. Thus, we discuss potential uses, risks, misuses, and opportunities associated with ChatGPT. We conclude with implications for teacher education, providing a series of recommended AI integration practices for teacher educators.

[Link to Paper](https://citejournal.org/volume-23/issue-1-23/editorial/editorial-chatgpt-challenges-opportunities-and-implications-for-teacher-education/)

Feel free to AMA!",active,3
11fj3tx,2653,2023-03-01,Accused of using AI on my high school social paper,u/feetstreetseat,ChatGPT,https://www.reddit.com/r/ChatGPT/comments/11fj3tx/accused_of_using_ai_on_my_high_school_social_paper/,"I (Grade 12) need help on what to do in this situation. My teacher used GPTzero, which detected parts of my paper as “AI written”. I write very formally, whilst also using grammarly premium. I’ve always been a high achieving student and I’m not sure why my teacher would think I cheated. I’ve told my teacher everything and he still doesn’t believe me. What should I do in this situation?!!

EDIT: Holy. I did not expect my post to get so much interaction and discussion, I didn’t expect my situation to be such a hot discussion. I tried to reply to all the comments but there’s too many!! Thank you to everyone who’s been helpful. There are some things I want to address that I keep seeing in the comments.
1. When I mentioned that I used grammarly to my teacher, he didn’t mention anything about that being cheating. He still thinks I used ChatGPT. I’ve used grammarly in all of my social/english classes for the past two years and never had issues with any teachers. 
2. Does my teacher have a vendetta or bias against me? Not on a personal level, but the teacher is known for being notoriously mean and unreasonable. I found him alright for most of the semester until this incident. He has had accusations against him about being racist, but I’m not sure if that’s the case here.
3. I’ve seen a few comments thinking I’m lying and actually cheated, just because I was aware of ChatGPT and this subreddit. People are assuming that I’m saying I never use ChatGPT. I have used the tool to help me with some chemistry and physics studying, but I have never used it for a paper. I have no reason to lie, I’m basically anonymous on reddit.

As for my next course of action, I will provide my teacher with all the evidence I can, to disprove the effectiveness of AI detectors. If that doesn’t work, I will bring it up to the higher-ups. I will make an update on Monday when I get the chance to talk about it with my teacher. Once again, thank you all for the support and help. It truly means a lot to me. :)

Edit 2:

After school I talked to my teacher for about half an hour about how AI detectors are inaccurate, and how they shouldn’t be used to make verdicts on cheating and what not. I showed him that it read one of my past papers as written by AI, and that the creators even said themselves that they are not 100% accurate. I showed my drafts and showed how if I made a few grammar errors, I could trick the AI detector. My teacher apologized and I ended up getting a 95 on my paper.

He also said he would bring it up to the other teachers, so hopefully this wont happen again to any other students at my school.

Again, thank you all for your help. Probably would’ve been screwed without this subreddit’s help.",User_deleted,2611
11fpp9o,1,2023-03-01,"Working on a report for school, can someone answer a few ethics related data science questions for me.",u/VelvetRevolver_,datascience,https://www.reddit.com/r/datascience/comments/11fpp9o/working_on_a_report_for_school_can_someone_answer/,"I have a report for school where I need to ask a data science professional some questions and then write a report on it. You don't have to answer all of them and the responses don't have to be that long they can be on the shorter side. Any help would be greatly appreciated. Thank you.

1) As AI advances do you see any possible risk of mass job displacement in the future? Such as self driving cars replacing truck drivers, taxi drivers, etc. Do you think this will be a problem in the future or will it be the same as all the times we've automated something in the past and people will just adapt to the job market?


2) Recently there has been some controversy around algorithmic bias, especially in data science. Such as automating parole decisions, job application screening, or applying for credit cards. Some people argue these machine learning algorithms have been somewhat racist/sexist in the past. Do you think data scientists should be doing their best to eliminate bias?


3) With the recent release of chat bots like chatGPT students have been using it to help them write papers or help with their programming assignments. Do you see anything wrong with claiming chatGPT's responses as your own work? Do you consider it plagiarism?


4) Art generation has gotten very popular recently and there have actually been some lawsuits against these AI's claiming they were trained on copyrighted images. Do you believe AI shouldn't be legally allowed to train on copyrighted material or will doing so significantly hinder AI's development as data scientists will have to be much more careful about how they obtain their datasets?


5) As AI and image detection/recognition algorithms become more withspread do you think adversarial attacks will ever be a significant and practical problem?",User_deleted,1
11fqinu,6,2023-03-01,Using ChatGPT to summarize Powerpoint slides,u/computerpoop,OpenAI,https://www.reddit.com/r/OpenAI/comments/11fqinu/using_chatgpt_to_summarize_powerpoint_slides/,"Hi all

I'm a medical student, and I have noticed that chatgpt does a really good job of summarizing and explaining slides when I copy and paste bullet points into the website.

I was wondering if anybody has used the API to go through powerpoints and do this for every slide, or have any idea on how that might be done? 

If anybody has the knowledge/skills to implement this, I would be willing to compensate you for your time as I think this would be a very valuable educational resource for not just me but many others.

Thanks!",User_deleted,29
11gd88z,69,2023-03-02,So I ran some of my old essays through GPTZero...,u/jaydoff,ChatGPT,https://www.reddit.com/r/ChatGPT/comments/11gd88z/so_i_ran_some_of_my_old_essays_through_gptzero/,"Almost every single paper I wrote might have ""included parts written by AI"". Keep in mind that all of these essays were written before ChatGPT was publicly available. For most of my papers, large sections of the text were flagged yellow for being likely written by an AI. A couple of my essays were even flagged as highly likely. Couple the dodgy results of AI detectors with tech illiterate teachers and professors that don't know the results are dodgy, and I predict that there's going to be a massive wave of kids that are going to get falsely accused of cheating. The AI vs. education arms race is ramping up and I'm just curious to see what happens. Surely schools are going to have to change the way they evaluate students right?",User_deleted,68
