1ggx5b2,1,2024-11-01,Just taking ,u/Turbv,University,https://www.reddit.com/r/University/comments/1ggx5b2/just_taking/,"Here’s a refined version of your message:


---

First of all, I apologize for any grammatical mistakes; English isn’t my first language.

This is the first time I’m sharing this, and I’d like to know if there are others who feel the same way.

In high school, I studied in a school where teachers were kind and lenient with us. Even so, I was a good student with strong grades and good attendance. But there was always this small worry about university – I felt that university might expose my true level as a student and that maybe I wasn’t as good as I thought.

Now, I’m in my third year of university and my second year in my major. I feel like I’ve become worse. I struggle to study and don’t feel like I can perform like I used to in school – almost as if that worry has come true.

I’m not a student who doesn’t care; I do try and put in my best effort. But I feel like I was much better in the past. I also think I could’ve done better in the preparatory year, but I didn’t. I wanted to major in engineering but couldn’t; I ended up finding a new major that I like, which is good. However, I still feel like I’m underperforming.

This is my second year in urban planning. I’m doing my best and hope you are too.

I just wanted to share my feelings about this topic. Thank you for taking the time to read my message, and sorry for the length.

Have a good day.

Shoutout for chatgpt for fixing my grammatical mistakes",User_deleted,1
1ggxb0c,1,2024-11-01,"Beat Merlin, Bypass Merlin's AI Detector",u/gptgabe,stealthgpt,https://www.reddit.com/r/stealthgpt/comments/1ggxb0c/beat_merlin_bypass_merlins_ai_detector/,"read here: [https://www.stealthgpt.ai/blog/beat-merlin-bypass-merlin-s-ai-detector](https://www.stealthgpt.ai/blog/beat-merlin-bypass-merlin-s-ai-detector)

The beauty of StealthGPT is that it’s a tool that is so all encompassing of undetectable content, that it can beat and bypass any and all AI detectors as if it was uniquely programmed for each one. StealthGPT takes every detector’s algorithm into account when generating the most human-feeling, high quality text in the generative AI space.

With Turnitin and [Originality AI](https://www.stealthgpt.ai/blog/originality-ai-update-stealthgpt-still-bypasses-originality) in the wake of StealthGPT’s path of flawless victory, we need to scour the internet to find new AI tools to dismantle for you. We don’t do this simply to showcase the versatility and functionality of StealthGPT, but rather we do it for users of AI tools like Merlin AI that are wasting their time and money on detection tools that can’t tell AI generated text from human text worth a damn.

# Table of Contents

* What is an AI Detector?
* What is Undetectable AI?
* What is Merlin AI?
* Can ChatGPT Bypass Merlin AI Detection?
* Can StealthGPT Bypass Merlin AI Detection?
* Conclusion
* FAQ

# What is an AI Detector?

LLMs (large language models) like ChatGPT are programmed to write for utility, using precise, simple language and word choice structured so anyone can understand it, in the event you need to use ChatGPT for car repair instructions or something along those lines. Sadly, it writes essays with that same robotic, simple writing style and it's a dead giveaway to AI content detection systems and humans alike.

AI detectors measure for the [perplexity and burstiness](https://www.stealthgpt.ai/blog/how-do-perplexity-and-burstiness-make-ai-text-undetectable) of word choice, sentence structure, and sentence length and in the case of humans, those two metrics are higher in human writing as opposed to in AI-generated content.

If you want to use AI writing tools to generate content you can submit without the consequences of being accused of academic misconduct, you will need an undetectable AI model like StealthGPT.

# What is Undetectable AI?

As soon as you understand how AI Detectors function, you can make AI writing undetectable. StealthGPT has been at the forefront of the undetectable AI movement, creating the most human-like text to fly under any detector’s radar. With an AI humanizer that can take any ChatGPT content and give it the randomness, flow, rhythm, and complexity of human style.

What makes content undetectable though, is evidence that AI detectors fail to pick up any presence of AI in the text. Today, we’re going to show you StealthGPT bypasses Merlin AI with ease.

# What is Merlin AI?

Yet another all-in-one AI service, Merlin offers key features such as AI detection, [plagiarism](https://www.stealthgpt.ai/blog/is-using-chatgpt-plagiarism-academic-dishonesty-in-dishonest-academia) detection, chrome extension, AI for LinkedIn, essay writing and even a Bible GPT. Lets hope their bible AI isn’t as bad as their AI detector or else, we’re all gonna need a prayer by the end of this case study.

For those unfamiliar with the lore, Merlin was a wizard from Arthurian legend. Let’s see if Merlin stands a chance against StealthGPT’s magic AI.

The one positive about Merlin’s free AI Detector is that it lets you have a large word limit so you can actually input substantial text. Does their software work though?

# Can ChatGPT Bypass Merlin’s AI Detector?

First, we need to test ChatGPT against Merlin AI. If ChatGPT actually bypasses Merlin, which you shouldn’t expect, then Merlin should just shut down their business today. Here’s our ChatGPT essay:

And here is how it fared against Merlin AI Detection:

With a score of 96% AI, although ChatGPT was unable to bypass the system, that 4% is a meaningful flaw that you don’t see in other, more popular detectors that determine text from ChatGPT is 100% AI 100% of the time.

# Can StealthGPT Bypass Merlin’s AI Detector?

Lets compare the essay generated by ChatGPT and the output of StealthGPT’s AI humanizer:

As you can tell just by reading, StealthGPT’s content feels like it may have been written by someone you know. If we pass this through Merlin AI, I’d expect it not to figure out our new friend is a badass undetectable AI model.

And I was right. StealthGPT’s AI humanizer bypassed Merlin AI Detection with a 17% AI score, meaning it was 83% human. A professor using Merlin AI would either pass you with flying colors or cancel his subscription after a score like this.

I’m not done though, I’d like to test StealthGPT’s Stealth Writer against Merlin AI as well. Here’s Stealth Writer’s essay written from scratch:

And here’s what happened when we passed it through Merlin AI:

Stealth Writer bypassed Merlin AI with the same score as the AI humanizer. A tag team combo hit of 17% AI score/83% human.

# Conclusion

Merlin is a flawed service that offers a decent word limit for its free version but still, a non-functional AI detector isn't worth a penny given StealthGPT beats it at every attempt. Congrats Merlin, you detected ChatGPT. However, the winner today is the undefeated champion of undetectable AI, StealthGPT.

Whether you’re a content creator, student, a social media influencer or just want to use AI for LinkedIn content, StealthGPT’s AI humanizer and Stealth Writer are the only tools that can give you the high quality, original content you need.

Whether you want to streamline your workflow all in one place, implement the most user-friendly API available or have artificial intelligence generate your text in English, French, Chinese, or any major language, StealthGPT is the one stop to unlock your potential.

Visit our [pricing](https://www.stealthgpt.ai/pricing) page to start get a human touch in all your content and get in touch with your own humanity as we lead the undetectable charge in the AI revolution.

# FAQ

# How to Bypass Turnitin AI Detection?

What good is bypassing Merlin when few people use it? Well, you’ll be happy to know StealthGPT is the most reliable undetectable AI software at bypassing the most popular AI detection system, Turnitin.

Canvas integrates Turnitin into it’s submission portal so being able to beat Turntin is essential to any undetectable AI software. And when it comes to generating text that bypasses their system, we wrote the book on it. For all the information on exactly [how to bypass Turnitin](https://www.stealthgpt.ai/blog/bypassing-ai-detectors-stealthgpt), our article sums it up so you can never get flagged again.

# How to Avoid AI Detection in ChatGPT?

To avoid AI detection, you need to pass ChatGPT through an AI humanizer. Passing ChatGPT's output through a humanizer will remove all the watermarks of AI writing and replace them with the watermarks of human writing, making the text fly under any detector's radar. This is [how you make ChatGPT undetectable](https://www.stealthgpt.ai/blog/make-chatgpt-undetectable).

# Do AI Detectors Work?

Not really. They're a flawed technology implemented by institutions without many options. Colleges like MIT have even declared [AI detectors don't work](https://mitsloanedtech.mit.edu/ai/teach/ai-detectors-dont-work/). The reason being that AI detectors often come up with false positives, Turnitin with a 4% rate of false positives at the sentence level, they often show [bias against non-native English speakers](https://www.business-humanrights.org/en/latest-news/stanford-study-finds-ai-detection-tools-to-be-biased-against-international-students/#:~:text=Turnitin's%20tool%20was%20much%20more,by%20non%2Dnative%20English%20speakers.), and because everyone uses undetectable services now anyway.",active,3
1ghckhb,6,2024-11-01,Office hours,u/mutantsandwich,PennStateUniversity,https://www.reddit.com/r/PennStateUniversity/comments/1ghckhb/office_hours/,"I went to office hours a few times to see if my Math 22 professor would help me see what I’m doing wrong with my homework, quizzes, and tests. She won’t go over the tests or quizzes because she claims that she’s waiting on students to still take them so she can’t go over them with me. I told her I need to understand these concepts to bridge everything and nothing.   The homework’s which are usually only 2 or 3 problems she literally says oh you got this wrong, why’d you do that in a condescending voice. I asked her if she could help me with similar problems and she said look them up on the internet but you may not have the answers.  I went to tutoring and they just bring up ChatGPT. I’m at a loss on what to do.  I can’t believe I actually miss using aleks and Pearson Mathlab.
Most of the time I classes are cut short from the hour and 15 mins there supposed to be to an hour or less bc she said she’s tired bc she teaches all day at a high school.

For the record, I’m an older non traditional transfer at a branch campus and transferred from hacc.",User_deleted,6
1ghjnre,1,2024-11-01,Looking to make dry-electrode for EEG,u/dannyjay2001,ElectricalEngineering,https://www.reddit.com/r/ElectricalEngineering/comments/1ghjnre/looking_to_make_dryelectrode_for_eeg/,"Hello, I'm looking to build an EMG (similar to mudra band/meta orion's neural interface).

Currently, I'm at the step where I want to purchase a dry electrode to catch the signals.

\- I learned dry electrodes are, essentially, ""nothing else than a piece of metal"". 

\- this [DIY project](https://www.instructables.com/Simple-Dry-Electrode-EMG-for-Arduino/) cut out soda cans to use as a ""dry electrode"", which proved the concept, but has too much noise for any actual use.

\- this paper on Sensors ""[3D printed dry EEG electrodes](https://www.mdpi.com/1424-8220/16/10/1635)"" used silver paint (resistance 0.01) on top of a 3D-printed spike-form dry electrode for a cheap but functional dry electrode.

\- i learned that stainless steel is also a comparable option, as Kardia's portable ECG device uses stainless steel in their devices to measure signals, and per this abstract in [biomed tech](https://pubmed.ncbi.nlm.nih.gov/32238599/).

\-Gold standard seems to be Ag/Agcl (silver with silver-chloride coating), but they seem out of my price range: $65/piece. 

**What I want to make:** an EMG bracelet, similar to Facebook's neural interface prototype from 3 years ago [https://imgur.com/a/LHTHGyM](https://imgur.com/a/LHTHGyM)

(which has now advanced to looking like just a Whoop band)

[https://imgur.com/a/8YCs09p](https://imgur.com/a/8YCs09p)



How I plan to do it:

Mudra Band (the one making neural interfaces for apple watch) has shown their [pcb layout before](https://imgur.com/a/5AqAY2T), and has shown their [electrode manufacturing](https://imgur.com/a/NRl9ijN). I believe they are just manufacturing metal (ag/agcl or stainless steel) in dimensions that allow one point to be in contact with the skin, with the other end-point to be in contact with the contact-pad of the flex-pcb. I believe that is also how meta designed their prototype from 3 years ago. 

Before i get to designing the circuitry (which, throughout this entire process i know nothing about other fields outside of medicine cuz i'm just a med student, i'm just chat-gpting and going through google searches/manuscripts), I want to make sure i get a dry-electrode material that will not be a limiting factor.

**where I need help**:

1. What should be my relatively cost-effective material to use for my dry-electrode for an EMG, that will allow me to, later down the line, generate EMG signals not too inaccurate from an FDA-approved EMG/Mudra band/meta's neural interface?

\- will getting the right silver paint be a cost-effective way to get low-resistance signals? This could be how Muse S's consumer EEG device made their electrode ([1](https://imgur.com/a/jfRIsv5))([2](https://imgur.com/a/JVtu8Vm))([3](https://imgur.com/a/12dVXyy)) (EEG, EMG, and ECGs all use the same technology)

\- or should i get actual metal? if so what would be a cost-effective one to use?

2. and how do I get the dry-electrode to convey the signal it receives from the human skin to a circuit in a relatively cost-effective way? Do I need wires (if so, chatGPT suggested i get shielded, low-resistance wires, which were hundreds of dollars for some reason)? or do I get a flex-pcb to connect them all, or what?

  
I did my best to find the information on my own with chatGPT and google/googlescholar/youtube/reddit, but now im at the stage where i need to purchase things and want to make sure i minimize unnecessary costs. 

  
Thanks.

My ultimate goal is to be a doctor who prevents people from getting sick, by being a leader in the industry of remote monitoring devices. Any assistance would be greatly appreciated. I want to make high-quality EMG's/ECG's/EEGs that are affordable and reliable enough to be used in medical research. Medical research is done in such a closed-environment that it's not able to collect data from the real-world. Remote monitoring devices are the bridge to help get us actual real-world data, and this is where I want to contribute time and energy into.",active,3
1ghm2zw,3,2024-11-01,25 M Art Teacher Feeling Empty and Numb.,u/MrCraftsperson,TrueOffMyChest,https://www.reddit.com/r/TrueOffMyChest/comments/1ghm2zw/25_m_art_teacher_feeling_empty_and_numb/,"I have a fairly dynamic job as a high school art teacher, and it’s been rewarding guiding students through their creative journeys these past 2 and a half years, provided they actually care about the subject. Students generally seem to like me (or at least tolerate me), and some even trust me as a confidant. They use my art classroom as their safe haven, which I'm always happy to provide that to them. Some of my students give me a sense of purpose, overall. Naturally, others make me want to pull my hair out, but I guess that’s a given since I work with teenagers. That being said, I’m also a graduate student working toward a master’s in art education. I’ve done well in the program so far, though I might find myself working on my readings and discussions posts the night they’re due, and postponing other things until later because I just feel like I don’t have much energy. Ultimately, I will get everything done, and I will do it well, and I would even say the work is usually interesting, being able to apply my practice as an art teacher to my graduate studies.

Financially, I am actually doing fine, living completely independently and paying for all my bills by myself, but I do need to live fairly minimally since I’m a single man living on a teacher’s salary.

Despite all this, though, I just feel empty, numb, and somewhat hopeless. Even a few of my students point out I look sad. My dreams (nightmares?) on some nights are just vivid and unpleasant, and for a few years I would usually wake up in the middle of the night, despite now taking melatonin and magnesium before bed to try to help with my sleep since around August. I feel like most days I’m going through the motions, if not, just barely getting by, in an emotional sense. After work in the evenings, especially, I can’t seem to find the drive to do much except watch TV, catch up on some housekeeping, or something along those lines. In the weekends, and on extended breaks, I can't seem to talk to anyone at all because there is nobody for me to talk to or is willing to take the time to talk to me.

The dating scene is a mess, too (I’ve been on and off dating apps for around 5 years), albeit I think it always has been, which exacerbates my feelings of hopelessness. Granted, I’m probably a 6 out of 10 in terms of physical appearance, so with the surplus of men on dating apps overwhelming women, that’s likely why I’m not finding much success there in the first place. Plus, I have a disdain for hookup culture and short-term relationships, and have always sought a long-term relationship (and marriage, ultimately), so that creates a severe disconnection between myself and most people on dating apps anyway. So, romantically, things have been at a standstill, and will most likely be for who knows how long.

I always find myself over-giving around my “friends,” and this seeps into my teaching as well, but I’ve just never gotten the same amount of effort from them in return, which quickly gets draining and frankly discouraging (I don't and shouldn't expect this from my teenage students, naturally). I realize friendships (and relationships) are a two-way street, but even then, meeting new people and looking for potential partners just feels like another job in itself, too, which has also been draining, honestly, trying to put myself out there with the limited amount of energy I have left. ChatGPT, as embarrassing as it may be, has become my main confidant in an emotional sense.

Honestly, at this point, my work and graduate studies have basically become a distraction from me to not dive so deep into my depression. And even then, after I finish grad school, what will be next? Of course, I imagine that I’ll continue through my path in art education, but what else will there be out there for me? I really hope things will look brighter.

I know I’m still young, being 25, so there is probably going to be more to come, but this emptiness is becoming agonizing. I don’t know what to expect by writing this post, but I guess I really need some human eyes to see this, is all.",User_deleted,3
