1i0c526,3,2025-01-13,"WIBTA for reporting what I know, even though it could potentially discredit someone’s accusation of sexual assault?",u/Round-Painter-31,AITAH,https://www.reddit.com/r/AITAH/comments/1i0c526/wibta_for_reporting_what_i_know_even_though_it/,"Hi all. This is a throwaway account as my main has identifiable posts about my crafts. I (31F) am a painter. I studied under a private teacher and also have a MFA. I got married at 25 to a lovely, wonderful man (he is 35 now) and he encouraged me to focus solely on my painting full time. I had a part time job at a design firm but it wasn’t really suiting me so with his support I quit that position and started volunteering at our local community center. They offer classes for different fine arts and crafts, think basket-weaving, carpentry, drawing, yarn arts, etc. This community center has a board of directors that is in charge of the employees/volunteers, and they have one person on the board who is essentially the ‘HR’ person and that person happens to be my sister Annie (F36, fake name). 

I started teaching a weekly painting class at the center, and happily for me it got popular enough that now I am teaching 4 days a week at the center. I truly love this job. I teach adults in all my classes, and in my Friday class, there are two people, Michelle (F early twenties) and Claude (M slightly older but also twenties). Michelle and Claude were originally a couple when they first started hanging around the community center. They would bounce in between classes and try out lots of different arts and crafts, as it seemed they got bored of subjects pretty easily. Michelle saw the flyer for the very first painting class I offered and that there was a waiting list for the next one. She wanted Claude to sign them up for the class but he kept forgetting apparently and she finally just reached out to me to ask to be in the next class, which I readily agreed to and got them both signed up. 

At the first class they attended, Michelle and Claude were quiet, attentive students, and it seemed overall that they had enjoyed the class as they kept returning and painting lovely pieces. But after a few weeks of classes, Claude stopped coming, and when I asked Michelle about it, she told me, “Oh, I think he’s really busy right now, he hasn’t been answering my texts.” 

I didn’t really think much of it. But one day at the center, I was informed of their chaotic history together by another teacher who had been at the center for a long time. Claude was MARRIED with a kid and he just also dated around! His wife worked a back breaking job at a factory if i recall correctly that she kept at because the factory offered daycare and she had learned a long time ago that she couldn't trust Claude with their kid. He had apparently managed to lock his keys + their child into their car one day and had to call the fire department. Claude and Michelle had met at Michelle’s cashier job and she seemed to think it was love at first sight. 

But Michelle (understandably) freaked the fuck out when she discovered she was the ‘other woman’. She found this out after they had been coming around to the classes for about 2 months. I think at that point they had been dating for a total of 6 or 7 months. She and Claude had a huge argument where she demanded that he leave his wife and child for her, and he refused and dumped her. This culminated in Michelle keying his car and spray-painting the word ‘bastard’ on his garage door. She has also had online friends harass Claude en masse to try and bully him into taking her back, and I have also heard that she is regularly leaving microwaved bags of poop on his wife’s doorstep? I can’t confirm or deny any of this as it was all heard second hand but if it is true, Michelle seems a little unhinged about this break up. 

My reluctant involvement here began this week on Tuesday when I stayed late in my studio/classroom set up to finish out a painting. I normally play music or a podcast without headphones when there is no one in my room, and that's what I was doing when I heard glass shattering from far away. I was obviously freaked out a little bit. The community center has a second level, where my classroom is, so I stepped out of the door and looked down through to the first level (where the main lobby is). I see a dripping wet Michelle and Claude, both seeming to be pretty drunk, giggling together and creeping through the door they had just broken the window of. I was in total “WTF” mode and this is probably going to be considered weird or intrusive on my part, but I didn’t call the cops, I just went to the security room and watched them move around the center on the cameras. It seemed to me at the time that Michelle was trying to find a room that didn’t have cameras as she kept pointing them out in each room they went into. And this as you may have guessed was because they were trying to have sex in here somewhere, lol. They finally went into the auditorium and had sex in the sound booth. There isn’t a visible camera in the sound booth, it is above the booth on the ceiling so she didn’t see it. 

The next day, I reported the broken window to my sister Annie, but left out the part about seeing Michelle and Claude on the security cameras, mostly because I didn’t want to embarrass anyone. This week, Michelle came to my Friday painting class, and she was noticeably off. She was quieter than usual, barely participated, and lingered after everyone else had left. Finally, she approached me, clearly distressed.

Michelle told me that Claude had sexually assaulted her the night they broke into the community center. She was crying and shaking, saying that he had taken advantage of her when she was drunk and vulnerable. She claimed she didn’t know what else to do and wanted to tell someone she trusted. Then she begged me not to tell anyone what happened between them, especially not Annie and the community center board.  

I froze. On one hand, I want to believe her—sexual assault is a horrific thing to experience, and I know that many survivors are not believed or are dismissed. I am a survivor of sexual assault myself and have experienced the disbelief. But on the other hand, I *saw* what happened that night. From the security footage, it looked completely consensual. Michelle was the one pointing out the cameras, leading Claude around, and ultimately taking him into the sound booth. They left together, still giggling. Nothing about what I saw matches the story Michelle told me.

And yet, I can’t shake the nagging thought that maybe I’m wrong. Maybe something happened in the sound booth that I didn’t see. Maybe the way it looked to me from the cameras isn’t the full story. Michelle’s pain seemed real, and the way she confided in me felt genuine. What if I dismiss her because of what I think I know, only for her to suffer even more?

But if I stay silent, Claude could be falsely accused of something he didn’t do. He’s not a great person—his history with Michelle and his wife proves that—but a false accusation of sexual assault is incredibly serious. I don’t know what to do. My instincts are completely at war with each other, and I feel sick just thinking about it. Selfishly I want to just forget that I saw anything, but that’s not even a fair thought to have since I *did* see something. AITA if I tell the board everything I know, knowing it could completely discredit Michelle? Or would I be the asshole if I stayed silent, constantly second-guessing myself and wondering if I’m enabling a lie—or worse, failing to stand by someone who truly needs help?

"
