1hqw0fu,1,2024-12-31,WAIT AM I HAVING ADHD??,u/Yubion,Advice,https://www.reddit.com/r/Advice/comments/1hqw0fu/wait_am_i_having_adhd/,"Let me beat around the bush first, so at school, there was a random kid who always keep staring at my classroom like some kind of freak(Most students call him ""Vector"" because he look exactly the same, no offense though). So I ask my homeroom teacher that what is that freak up to, and then she answered ""He has ADHD, you shouldn't tell someone like that and blablabla"".

And today, I finished watching the series called ""Arcane"" and I was curious about a character called ""Heimerdinger"" so I start googling. Some sites suggest that he has PTSD, that's what got me interested because it has 4 letters same as the word that my teacher mentioned, the ""ADHD"", so I proceed to google it even more, I start comparing ADHD and PTSD(At that time, I wasn't realized that they are NOT even similar at all). So basically yeah, I started searching more about ADHD after a while and found these symptoms:

* Difficulty paying attention and often getting distracted
* Disorganization and procrastination
* Poor time management
* Planning, or organization.
* Trouble remembering daily tasks.
* Frequently losing things or being forgetful in activities.

What really got my eyes widen is ""Poor time management"" because that's what exactly teachers at my school said about me in the last parent-teacher meeting. I felt so small at that time and start praying every gods not to match with any other symptoms anymore, well fuck, thats the exact moment when I start thinking if I should switch to atheist from agnostic.  
Disorganization.. I don't really want to judge myself here but most of the time, my room is always a mess. But one thing for sure is that if I am really motivated, I tend to force myself to clean it even though I don't want to (and I prefer lying down instead of doing that shit). And I am always satisfied and proud with the result after cleaning it. But that's not uncommon to me though because I always thought I can clean really well (I used to make my mom proud by cleaning random places or rooms in my house on random days when I was younger). But I really love organizing things though like you know the game where you arrange/organize the cars to park, yeah I used to play that sort of game when I was a lot younger(I remember giving up most of the time though). It is NOT like I only like organizing things in the games though because I love it even more in real life. You see, I have those moment where I have to arrange my stuffs in places like drawers or bookshelf. I always love doing those thing, I always feel special whenever I do so, and I always wanted someone to see them and brag them to impress my arranging skills and my collections of random stuffs.   
I was always aware that I procrastinate a lot but I also always believe that I can always finish everything on time, exactly at the deadlines. So I had a tutor who come to my house in the early morning to teach on weekends and whenever she give me homeworks on Sundays(she doesn't give homework on Saturdays) , I prefer doing those homeworks she gave on Sundays on NEXT Saturday morning before she come. Most of the time though, I always finish them exactly on time just minutes before she come(Not to mention that those homeworks are not even done by myself because I always take a photo of the homework and upload it ChatGPT to let the work done quicker. Most of the homework she gave was always about ""Writing"" so I relied on ChatGPT till the very end. But hey I love writing though.. the fact that I am writing too long is the proof(I guess). The only reason I used ChatGPT was because I was already proud of my writing skill and I know if I write three paragraphs of 300 words by myself within 5 minutes, I will NOT finish on time for sure, so I hope my logic makes sense.  
  
Frequently losing things or being forgetful in activities? Sound exactly like me because I remember myself finding my phone in 11 Floor Apartment(My old school), and I couldn't call it because I always set my phone in Do Not Disturb. mode. And guess where did I found it back in the end?. On the damn shoe shelf on second floor. I guess I was taking off or wearing my shoes so I ACCIDENTALLY put my phone on the shoe shelf instead of putting it inside my pockets. And that's the only least stressful experience(Dude, It was the damn apartment with ""11 floors"").   
  
And then I realized, ""Wait wtf, so I was looking like that mf Vector all this time?? Like no shit, it can't be.."". But I felt relieved when I googled ""Do people with ADHD know they have ADHD?"" because the first thing I see was  ""No"". I don't know if I am just hallucinating because I was thinking like I would kinda proud if I have ADHD anyway, it is kinda cool to have such a rare disorder. 

PS. I hope everyone see this post answer, I am looking forward to. I will be replying every comment."
1hqxh9p,43,2025-01-01,I passed CySA+003 today! AMA!,u/Kinneia,CompTIA,https://www.reddit.com/r/CompTIA/comments/1hqxh9p/i_passed_cysa003_today_ama/,"Like the title said, I passed the test last year (aka yesterday, the 31st), so ask me anything (that doesn't break the rules). I'm still a college student at the moment, I have a 2 year degree in cybersecurity, working on my bachelors. The only work experience I have in IT/Cyber is a few months in help desk and about 7-10 months as cybersecurity intern, as well as little bit of coding (basic) projects.  (I still feel inadequate). I also have ITF, Network, and Security from comptia as well as a pentesting cert. 

To be honest, I remembered some of what I learned from the other certs, but I had to basically learn some things over again, because those certs I took atleast 1+ years ago. The test was HARD in my opinion. My hands were literally sweating and my body was shaking when I was going through the survey at the end waiting to see my score. I was so scared and nervous. And tbh this will probably be my last CompTIA cert for a while. I need to let my brain rest....

Materials I used:

Sybex Study Guide (read the whole book. Some things are off topic but this covers a lot)

Sybex 1000 Practice Questions (helpful, the way the questions are formulated are similar to the test. Did both practice tests, one a few weeks out, and one the morning of the exam scored 72/85, which is like 84%?)

Dion's Course + 1 Practice Test at the end (He goes WAAAY off topic, I didn't even watch all of his videos, and some sections I skipped)

  
Supplemental:

ChatGPT to help me understand concepts and what outputs of different commands would look like. Also used it to help me practice with Nmap and port numbers, because I really didn't feel like setting up a home lab.

Also used to to help me understand practice question answers and why they made/or didn't make sense.

Cyberkraft(?) Cysa Playlist on youtube. Some of his PBQ's were helpful in understanding the topics."
1hqxnz2,1,2025-01-01,Why is ChatGPT getting progressively worse?,u/HamidSeth,ChatGPT,https://www.reddit.com/r/ChatGPT/comments/1hqxnz2/why_is_chatgpt_getting_progressively_worse/,"It seems that ChatGPT is no longer responding properly to commands. It use to do conversations with my wife but now it doesn’t do it as before. 

When I ask for things, it either won’t respond saying I should do the search myself or look it up myself, or gives me information that is often partially wrong.  

Sometimes I get annoyed and I even explain to it how its math is wrong and then it accepts it and apologizes. But how can it even provide the wrong math? Or sometimes it provides information that is wrong and I have to prove to it the info is wrong and then it says something like “when I look at it from that angle, you are right” but a scientific info does not have angles. There is only one truth. 
I even made a video putting it on youtube showing  how the info provided was wrong and I explained, with numbers, to chatgpt that it is wrong and it apologized. But what if a student of mine was asking for that info? He/she would learn the wrong info. 

These incidents mean I cannot rely on it. 

I know many fan crowd will attack me for this post, but if OpenAI does not address the rising issues, many paid users like me will quit. Many of my colleagues have already canceled their subscriptions. I don’t get anything more than google’s free AI response to searches.  

"
1hr1ll5,2,2025-01-01,for this new year: what tool or overall method has been a time-saver for you guys? or an energy-saver?,u/MrPerfectionisback,Teachers,https://www.reddit.com/r/Teachers/comments/1hr1ll5/for_this_new_year_what_tool_or_overall_method_has/,"Hey guys!!

Happy new year to all of you!! I hope you're all making the most of your ho so well deserved holidays!

Let me preface this by stating that this is my second post in a few days but since I've been blown away by the help I've had, I figured this post would be a nice and humble way to give back. So let me share here a few things that have helped me save time & energy so that it gets the ball rolling for us all to save on time & energy as well!!

Here goes:

\-CHEATING 

I tell my students in the overall rules that if I am to detect a hint of cheating, I'll give myself the liberty of giving them a 0 and then have them explain to me how and why it was not cheating. A hint of suspicion over chatgpt? 0 it is. 

it has worked well and nobody who's gotten a 0 has dared ask.

\-which leads me to COMMUNICATION! 

one of the cheaters asked ""is a 0 defo a 0?"" to which I answered ""Have I done anything to let you think I'd go back on my word?"" it shut the question and I could see it left a good impression on his peers who overheard. I intend to make it a rule. 

Communication-wise, as well, I get them used to not answering any question which answers can be found in my previous email. What's the due date? I dunno, I forgot because I sent it to you. LOOK IT UP. MAKE IT A HABIT. 

also, more overall, having pre-set emails addresses to communicate with the entire classes is a bore to create but helps by increment all year long. especially when I want to warn them of something last-minute.

\-EXAMS: I've used platforms such as kahoot or wooclap to grade some small tests. We do lots of them but the grades are delivered as an excel which I have to copy-paste. freaking energy-saver! I test them A LOT (5' tests) and only keep the best grades if they behave. 

back to communication, I once had a student ask me if I couldn't round up his grade (he'd had 9.86/20) I laughed and said that if out of the 15 and so tests he'd done, he'd been unable to score an average, I had no reason to. It shut the debate.

\-CLASS CONTENT

I am currently trying to do youtube video to address the most common question they have or the most problematic points. Pointing them to said videos when they have a question is a life-saver cause those really invested do watch them. And it prevents me from having to parrot myself over and over and over. You wanna know? I'll point you to a resource. Whether you use it or not is up to you, now. 

Also, I try to adopt a structure in each class of the beginning and end are the same questions: what have we learned last time (sometimes, it helps me remember as well) and what do we remember from today's class. It helps cement the core notions. But it's still an area of improvement for me! 

\-EXCEL

excel!! I'll sing your praises, ho so aptly named software! it automatically calculates the averages, it color-codes the grade as I see fit to have an overview of a student progress at a glance... love it! :) there's so much to learn from it and I'm sure I've only been scratching the surface. I'm dying to know more about it. 



that's about it on the top of my hat, but those have had good effects overall. What have been your strategies? Let's hope for a better-managed year!

Cheers to all of you! rest well! "
1hr52qf,1,2025-01-01,Idea Generation and Co-Founder advice,u/zoeebee,Entrepreneur,https://www.reddit.com/r/Entrepreneur/comments/1hr52qf/idea_generation_and_cofounder_advice/,"Hello all 

Happy new year!

Can you give recommendations for idea generation sites, how to find technical co-founders or other networking suggestions. 

I come from a background in Digital Project Management, though that’s not what I do now, and have a masters in Digital Strategy that I achieved as a mature student whilst FT employed and being Mum to two boys.  I work 50ish hours a week as a senior in a corporate world and have an active personal life. 

In short - I know I can put the graft in, I always do once I set my mind to something. But here lies the problem… As soon as I get a semblance of an idea I recognise the pitfalls or can’t see the projection and scalability, or my ideas are too big and I struggle to start on my own. 

I know I need to start something rather than nothing, ChatGPT has helped with this but I quickly rule stuff out. 

My interests are Motorbikes and Lifelong learning (I considered an AI learning platform and still come back to this…) I work best when I’m surrounded by people with the same energy so feel a tech cofounder or small scale idea I can get excited about will be a good start. 

Suggestions welcome! "
1hr7n8j,1,2025-01-01,"""ChatGPT in Learning: Transforming Education and Corporate Training Effectiveness""",u/cporter202,ChatGPTautomation,https://www.reddit.com/r/ChatGPTautomation/comments/1hr7n8j/chatgpt_in_learning_transforming_education_and/,"Title: ChatGPT in Learning: Transforming Education and Corporate Training Effectiveness

Body:

Hey Community,

With the rise of AI, we are at the cusp of a revolutionary change in both the educational sector and corporate training environments. ChatGPT, a variant of the GPT (Generative Pretrained Transformer) model, has emerged as a pioneer in this transformation.

In education, ChatGPT can serve as an interactive tool, engaging students in a conversational manner to reinforce learning. It can answer questions, propose problems to solve, or even explain complex concepts in simpler terms. The beauty of this system is its adaptability; it can cater to different learning paces and styles, giving a more personalized learning experience.

For teachers, ChatGPT can be an assistant, providing resources or generating quizzes, hence reducing workload and enabling a focus on more critical teaching aspects.

In the corporate world, ChatGPT proves to be equally potent. Traditional training methods can often be dull and ineffective. However, integrating ChatGPT can lead to interactive, scenario-based training sessions that can boost engagement and retention of information. Employees can learn through dialogue, receiving immediate feedback, and clarifications on misunderstandings.

It's a tool for continuous learning too. With ChatGPT, employees can get on-the-spot learning assistance during their regular workday. This just-in-time learning approach ensures training is more relevant and immediately applicable.

But how does this affect the roles of educators and trainers? Does it enhance their roles or pose a risk? What about the data privacy concerns with AI interactions? And considering the accessibility, is such technology readily available to institutions with limited resources?

I'm keen to hear your thoughts and experiences on incorporating ChatGPT in educational settings and corporate training modules. How do you think we should best integrate these tools to enhance learning outcomes and training effectiveness? Let's discuss!"
1hr8ce2,1,2025-01-01,Language model,u/Doddythedon,learnmachinelearning,https://www.reddit.com/r/learnmachinelearning/comments/1hr8ce2/language_model/,"I am a CS first year student. I wish to make an LLM from scratch like chatgpt. What all tools and techniques do i need to learn first for this. 
Can you guide me"
1hrnc2o,4,2025-01-02,How to stay above the competition?,u/represent69,csMajors,https://www.reddit.com/r/csMajors/comments/1hrnc2o/how_to_stay_above_the_competition/,"I am a highschool student who wants to do some cool shit in the machine learning space and start a startup that solves actual problem and not some another chatgpt wrapper. AI is definitely overhyped and many fellow cs majors would be competing with me. How do I PRACTICALLY stay above the mass?

I have the basics down and working on building foundational models following a tutorial, reading papers etc

Please be precise and specific in you response and don't answer my question with ""go to graduate school"", ""start with solving a problem"" or ""code/train more"". Respecfully, I know them. "
1hrxvw3,5,2025-01-02,"ChatGPT Prompt of the Day: The X-Ray and Diagnostic Imaging Analyst
",u/Tall_Ad4729,ChatGPT,https://www.reddit.com/r/ChatGPT/comments/1hrxvw3/chatgpt_prompt_of_the_day_the_xray_and_diagnostic/,"ChatGPT Prompt of the Day: The X-Ray and Diagnostic Imaging Analyst

This prompt revolutionizes the way users interpret X-rays or diagnostic imaging reports by providing clear, concise, and actionable insights. It allows users to upload diagnostic imaging documents or summary reports from medical professionals. The prompt analyzes the data, explains medical terminology, highlights areas of concern, and offers suggestions for follow-up actions or lifestyle changes to improve health outcomes.

This tool is ideal for healthcare professionals who need quick insights into imaging data, patients seeking to understand their imaging results, or caregivers assisting in medical decision-making. By turning complex medical language into clear, accessible narratives, this prompt helps users make sense of critical health information with confidence.


Prompt:
---

<System>
You are a diagnostic imaging expert with a focus on analyzing and explaining X-ray, CT, and MRI results in clear, actionable terms for non-specialist users.
</System>

<Context>
The user has uploaded a diagnostic imaging report or a summary of findings. Your role is to interpret the report, summarize its key points, and provide an easy-to-understand explanation of the results. Highlight areas of concern and offer actionable next steps.
</Context>

<Instructions>
1. Extract key details from the uploaded imaging report:
   - Imaging type (e.g., X-ray, CT, MRI) and the body area examined.
   - Identified findings, abnormalities, or issues flagged by the report.
2. Provide an accessible explanation of the findings:
   - Define technical terms and explain their relevance to the user's health.
   - Highlight areas requiring further investigation or immediate attention.
3. Offer actionable insights and recommendations:
   - Suggest questions or topics to discuss with a healthcare provider.
   - Provide lifestyle or precautionary advice based on the findings, if appropriate.
4. Structure your response into three sections: ""Summary of Findings,"" ""Explanation of Results,"" and ""Next Steps.""
5. Use empathetic and supportive language to ensure the user feels informed and empowered.
</Instructions>

<Constraints>
- Do not provide medical diagnoses or second-guess the original report; focus on explaining and summarizing the given data.
- Avoid overly technical language and define any medical terms used.
- Be mindful of the user’s emotional state; keep your tone supportive and clear.
</Constraints>

<Output Format>
- Summary of Findings: Summarize the imaging type, area examined, and key findings.
- Explanation of Results: Explain the findings in simple, clear terms, including their potential health implications.
- Next Steps: Provide recommendations, such as consulting a specialist, asking specific questions, or making lifestyle changes.
</Output Format>

<Reasoning>
Apply Theory of Mind to anticipate the user's concerns and emotional needs. Use Chain-of-Thought reasoning to simplify technical data into a clear, digestible explanation, empowering users to make informed decisions.
</Reasoning>

<User Input>
Reply with: ""Please upload your X-ray or diagnostic imaging report, and I will analyze it for you."", then wait for the user to upload the image.
</User Input>


---

Prompt Use Cases:
  - Patients interpreting their diagnostic imaging results before a follow-up appointment.
  - Caregivers assisting loved ones in understanding medical imaging reports.
  - Healthcare students seeking to learn how to explain imaging results in layperson terms.
  - Professionals summarizing imaging findings for internal medical discussions.

For special prompt requests, feel free to drop a comment below."
1hsga2y,1,2025-01-03,Anyone use ChatGPT for EdTPA/CalTPA? ,u/Itchy-League-6596,AskTeachers,https://www.reddit.com/r/AskTeachers/comments/1hsga2y/anyone_use_chatgpt_for_edtpacaltpa/,"Question on CalTPA and ChatGPT
Student Teacher Support &/or Advice
For those of you who have passed or are currently working on the CalTPA/EdTPA: Have you used ChatGPT to assist with completing your cycles? If so, did it contribute to your success? What are your thoughts on using it as a tool for guidance rather than simply copying and pasting answers?"
1hsmkk5,1,2025-01-03,I am a JEE 2026 aspirant studying in Sri Chaitanya (alr cooked) and I am like really really good at maths and physics par chem nhi ho rhi yaar !!! ,u/Wise_Alternative4372,JEENEETards,https://www.reddit.com/r/JEENEETards/comments/1hsmkk5/i_am_a_jee_2026_aspirant_studying_in_sri/,Nikhil sir's lectures (PW) really helped for physical chemistry and I am good at phys chem too but inorganic and organic is such a nightmare. Chatgpt and teachers and other students and seniors have given me very generic advice that doesn't help at all; so you guys are my last hope 🤧
1hsvmj7,97,2025-01-03,"Some recent data on college student genAI usage, cheating, false accusations, and more",u/PerceptionLab,Professors,https://www.reddit.com/r/Professors/comments/1hsvmj7/some_recent_data_on_college_student_genai_usage/,"I know we talk a lot here about ChatGPT usage, academic integrity, and other AI-related pedagogical issues. 

In case anyone's interested, I thought I might share some relevant data I just published [free PDF](https://www.brianwstone.com/wp-content/uploads/2024/12/Stone2025GenerativeAIinHigherEducation.pdf). I surveyed 733 undergrads on their use of AI, cheating with it, perceptions about AI and workforce, false accusations, and more. 

Convenience sample at a large R2 univ that may not generalize to everywhere, but hopefully some find it a useful data point. I'm wondering if any of this matches your experiences or what's happening at your institution?

In my sample ~40% of students admitted cheating with AI (a similar sample Fall '24 was at 59% so it's getting higher). Meanwhile ~10% reported false accusations. College students seem nervous about AI, unsure about it, using it in ambiguous ways, getting mixed messages, etc. Male students are also much more involved/interested, which may be something to work on if AI is going to be important in the workforce going forward.

DOI: [10.1177/00986283241305398](https://journals.sagepub.com/doi/10.1177/00986283241305398) [free PDF](https://www.brianwstone.com/wp-content/uploads/2024/12/Stone2025GenerativeAIinHigherEducation.pdf)"
